Classification,Year,Period,Period Desc.,Aggregate Level,Is Leaf Code,Trade Flow Code,Trade Flow,Reporter Code,Reporter,Reporter ISO,Partner Code,Partner,Partner ISO,2nd Partner Code,2nd Partner,2nd Partner ISO,Customs Proc. Code,Customs,Mode of Transport Code,Mode of Transport,Commodity Code,Commodity,Qty Unit Code,Qty Unit,Qty,Alt Qty Unit Code,Alt Qty Unit,Alt Qty,Netweight (kg),Gross weight (kg),Trade Value (US$),CIF Trade Value (US$),FOB Trade Value (US$),Flag
H5,2020,2020,2020,6,1,1,Import,410,Rep. of Korea,KOR,392,Japan,JPN,,,,,,,,10190,Mules and hinnies; live,5,Number of items,2,,,,26,,1405,,,0
H5,2020,2020,2020,6,1,1,Import,410,Rep. of Korea,KOR,392,Japan,JPN,,,,,,,,10611,"Mammals; live, primates",5,Number of items,49,,,,170,,11781,,,0
H5,2020,2020,2020,6,1,1,Import,410,Rep. of Korea,KOR,392,Japan,JPN,,,,,,,,10614,"Mammals; live, rabbits and hares",5,Number of items,114,,,,286,,74132,,,0
H5,2020,2020,2020,6,1,1,Import,410,Rep. of Korea,KOR,392,Japan,JPN,,,,,,,,10619,"Mammals; live, other than primates, whales, dolphins, porpoises (mammals of the order Cetacea); manatees, dugongs (mammals of the order Sirenia); seals, sea lions, walruses (mammals of the suborder Pinnipedia), camels, other camelids, rabbits and hares",5,Number of items,111933,,,,27356,,3816777,,,0
H5,2020,2020,2020,6,1,1,Import,410,Rep. of Korea,KOR,392,Japan,JPN,,,,,,,,10620,Reptiles; live (including snakes and turtles),5,Number of items,402,,,,19,,20027,,,0
H5,2020,2020,2020,6,1,1,Import,410,Rep. of Korea,KOR,392,Japan,JPN,,,,,,,,10649,"Insects; live, other than bees",5,Number of items,10,,,,1,,20,,,4
H5,2020,2020,2020,6,1,1,Import,410,Rep. of Korea,KOR,392,Japan,JPN,,,,,,,,10690,"Animals; live, n.e.c. in chapter 01, other than mammals, reptiles, birds and insects",5,Number of items,513,,,,19,,14403,,,0
H5,2020,2020,2020,6,1,1,Import,410,Rep. of Korea,KOR,392,Japan,JPN,,,,,,,,30111,"Fish; live, ornamental, freshwater",8,Weight in kilograms,473,,,,473,,87199,,,0
H5,2020,2020,2020,6,1,1,Import,410,Rep. of Korea,KOR,392,Japan,JPN,,,,,,,,30119,"Fish; live, ornamental, other than freshwater",8,Weight in kilograms,1474,,,,1474,,371251,,,0
H5,2020,2020,2020,6,1,1,Import,410,Rep. of Korea,KOR,392,Japan,JPN,,,,,,,,30194,"Fish; live, Atlantic and Pacific bluefin tunas (Thunnus thynnus, Thunnus orientalis)",8,Weight in kilograms,3460,,,,3460,,245689,,,0
H5,2020,2020,2020,6,1,1,Import,410,Rep. of Korea,KOR,392,Japan,JPN,,,,,,,,30199,"Fish; live, n.e.c. in heading 0301",8,Weight in kilograms,6793742,,,,6793742,,50717844,,,0
H5,2020,2020,2020,6,1,1,Import,410,Rep. of Korea,KOR,392,Japan,JPN,,,,,,,,30229,"Fish; fresh or chilled, flat fish, n.e.c. in item no. 0302.2, excluding fillets, fish meat of 0304, and edible fish offal of subheadings 0302.91 to 0302.99",8,Weight in kilograms,270,,,,270,,339,,,0
H5,2020,2020,2020,6,1,1,Import,410,Rep. of Korea,KOR,392,Japan,JPN,,,,,,,,30235,"Fish; fresh or chilled, Atlantic and Pacific bluefin tunas (Thunnus thynnus, Thunnus orientalis), excluding fillets, fish meat of 0304, and edible fish offal of subheadings 0302.91 to 0302.99",8,Weight in kilograms,7178,,,,7178,,231468,,,0
H5,2020,2020,2020,6,1,1,Import,410,Rep. of Korea,KOR,392,Japan,JPN,,,,,,,,30239,"Fish; fresh or chilled, tuna, n.e.c. in item no. 0302.3, excluding fillets, fish meat of 0304, and edible fish offal of subheadings 0302.91 to 0302.99",8,Weight in kilograms,9,,,,9,,879,,,0
H5,2020,2020,2020,6,1,1,Import,410,Rep. of Korea,KOR,392,Japan,JPN,,,,,,,,30244,"Fish; fresh or chilled, mackerel (Scomber scombrus, Scomber australasicus, Scomber japonicus), excluding fillets, fish meat of 0304, and edible fish offal of subheadings 0302.91 to 0302.99",8,Weight in kilograms,99032,,,,99032,,240440,,,0
H5,2020,2020,2020,6,1,1,Import,410,Rep. of Korea,KOR,392,Japan,JPN,,,,,,,,30249,"Fish; fresh or chilled, n.e.c. in item no. 0302.4, excluding fillets, fish meat of 0304, and edible fish offal of subheadings 0302.91 to 0302.99",8,Weight in kilograms,134,,,,134,,1207,,,0
H5,2020,2020,2020,6,1,1,Import,410,Rep. of Korea,KOR,392,Japan,JPN,,,,,,,,30251,"Fish; fresh or chilled, cod (Gadus morhua, Gadus ogac, Gadus macrocephalus), excluding fillets, fish meat of 0304, and edible fish offal of subheadings 0302.91 to 0302.99",8,Weight in kilograms,75023,,,,75023,,221201,,,0
H5,2020,2020,2020,6,1,1,Import,410,Rep. of Korea,KOR,392,Japan,JPN,,,,,,,,30255,"Fish; fresh or chilled, Alaska pollack (Theragra chalcogramma), excluding fillets, fish meat of 0304, and edible fish offal of subheadings 0302.91 to 0302.99",8,Weight in kilograms,1699485,,,,1699485,,6056542,,,0
H5,2020,2020,2020,6,1,1,Import,410,Rep. of Korea,KOR,392,Japan,JPN,,,,,,,,30282,"Fish; fresh or chilled, rays and skates (Rajidae), excluding fillets, fish meat of 0304, and edible fish offal of subheadings 0302.91 to 0302.99",8,Weight in kilograms,877302,,,,877302,,5155357,,,0
H5,2020,2020,2020,6,1,1,Import,410,Rep. of Korea,KOR,392,Japan,JPN,,,,,,,,30285,"Fish; fresh or chilled, seabream (Sparidae), excluding fillets, fish meat of 0304, and edible fish offal of subheadings 0302.91 to 0302.99",8,Weight in kilograms,56188,,,,56188,,348280,,,0
H5,2020,2020,2020,6,1,1,Import,410,Rep. of Korea,KOR,392,Japan,JPN,,,,,,,,30289,"Fish; fresh or chilled, n.e.c. in heading 0302, excluding fillets, fish meat of 0304, and edible fish offal of subheadings 0302.91 to 0302.99",8,Weight in kilograms,367037,,,,367037,,3219440,,,0
H5,2020,2020,2020,6,1,1,Import,410,Rep. of Korea,KOR,392,Japan,JPN,,,,,,,,30291,"Fish; fresh or chilled, livers, roes and milt",8,Weight in kilograms,2,,,,2,,2,,,0
H5,2020,2020,2020,6,1,1,Import,410,Rep. of Korea,KOR,392,Japan,JPN,,,,,,,,30312,"Fish; frozen, Pacific salmon (Oncorhynchus gorbuscha/keta/tschawytscha/ kisutch/masou/rhodurus) other than sockeye salmon (Oncorhynchus nerka), excluding fillets, fish meat of 0304, and edible fish offal of subheadings 0303.91 to 0303.99",8,Weight in kilograms,140,,,,140,,772,,,0
H5,2020,2020,2020,6,1,1,Import,410,Rep. of Korea,KOR,392,Japan,JPN,,,,,,,,30342,"Fish; frozen, yellowfin tunas (Thunnus albacares), excluding fillets, fish meat of 0304, and edible fish offal of subheadings 0303.91 to 0303.99",8,Weight in kilograms,915,,,,915,,957,,,0
H5,2020,2020,2020,6,1,1,Import,410,Rep. of Korea,KOR,392,Japan,JPN,,,,,,,,30344,"Fish; frozen, bigeye tunas (Thunnus obesus), excluding fillets, fish meat of 0304, and edible fish offal of subheadings 0303.91 to 0303.99",8,Weight in kilograms,31651,,,,31651,,120504,,,0
H5,2020,2020,2020,6,1,1,Import,410,Rep. of Korea,KOR,392,Japan,JPN,,,,,,,,30345,"Fish; frozen, Atlantic and Pacific bluefin tunas (Thunnus thynnus, Thunnus orientalis), excluding fillets, fish meat of 0304, and edible fish offal of subheadings 0303.91 to 0303.99",8,Weight in kilograms,1204,,,,1204,,10046,,,0
H5,2020,2020,2020,6,1,1,Import,410,Rep. of Korea,KOR,392,Japan,JPN,,,,,,,,30346,"Fish; frozen, southern bluefin tunas (Thunnus maccoyii), excluding fillets, fish meat of 0304, and edible fish offal of subheadings 0303.91 to 0303.99",8,Weight in kilograms,79402,,,,79402,,712325,,,0
H5,2020,2020,2020,6,1,1,Import,410,Rep. of Korea,KOR,392,Japan,JPN,,,,,,,,30349,"Fish; frozen, tuna, n.e.c. in item no. 0303.4, excluding fillets, fish meat of 0304, and edible fish offal of subheadings 0303.91 to 0303.99",8,Weight in kilograms,6,,,,6,,502,,,0
H5,2020,2020,2020,6,1,1,Import,410,Rep. of Korea,KOR,392,Japan,JPN,,,,,,,,30353,"Fish; frozen, sardines (Sardina pilchardus, Sardinops spp.), sardinella (Sardinella spp.), brisling or sprats (Sprattus sprattus), excluding fillets, fish meat of 0304, and edible fish offal of subheadings 0303.91 to 0303.99",8,Weight in kilograms,1491460,,,,1491460,,1208821,,,0
H5,2020,2020,2020,6,1,1,Import,410,Rep. of Korea,KOR,392,Japan,JPN,,,,,,,,30354,"Fish; frozen, mackerel (Scomber scombrus, Scomber australasicus, Scomber japonicus), excluding fillets, fish meat of 0304, and edible fish offal of subheadings 0303.91 to 0303.99",8,Weight in kilograms,90300,,,,90300,,147730,,,0
H5,2020,2020,2020,6,1,1,Import,410,Rep. of Korea,KOR,392,Japan,JPN,,,,,,,,30357,"Fish; frozen, swordfish (Xiphias gladius), excluding fillets, fish meat of 0304, and edible fish offal of subheadings 0303.91 to 0303.99",8,Weight in kilograms,22112,,,,22112,,131080,,,0
H5,2020,2020,2020,6,1,1,Import,410,Rep. of Korea,KOR,392,Japan,JPN,,,,,,,,30359,"Fish; frozen, n.e.c. in item no. 0303.5, excluding fillets, fish meat of 0304, and edible fish offal of subheadings 0303.91 to 0303.99",8,Weight in kilograms,1764140,,,,1764140,,1766620,,,0
H5,2020,2020,2020,6,1,1,Import,410,Rep. of Korea,KOR,392,Japan,JPN,,,,,,,,30367,"Fish; frozen, Alaska pollack (Theraga chalcogramma), excluding fillets, fish meat of 0304, and edible fish offal of subheadings 0303.91 to 0303.99",8,Weight in kilograms,24150,,,,24150,,27782,,,0
H5,2020,2020,2020,6,1,1,Import,410,Rep. of Korea,KOR,392,Japan,JPN,,,,,,,,30381,"Fish; frozen, dogfish and other sharks, excluding fillets, fish meat of 0304, and edible fish offal of subheadings 0303.91 to 0303.99",8,Weight in kilograms,4605,,,,4605,,15887,,,0
H5,2020,2020,2020,6,1,1,Import,410,Rep. of Korea,KOR,392,Japan,JPN,,,,,,,,30382,"Fish; frozen, rays and skates (Rajidae), excluding fillets, fish meat of 0304, and edible fish offal of subheadings 0303.91 to 0303.99",8,Weight in kilograms,270322,,,,270322,,1159334,,,0
H5,2020,2020,2020,6,1,1,Import,410,Rep. of Korea,KOR,392,Japan,JPN,,,,,,,,30389,"Fish; frozen, n.e.c. in heading 0303, excluding fillets, fish meat of 0304, and edible fish offal of subheadings 0303.91 to 0303.99",8,Weight in kilograms,532880,,,,532880,,1950401,,,0
H5,2020,2020,2020,6,1,1,Import,410,Rep. of Korea,KOR,392,Japan,JPN,,,,,,,,30391,"Fish; frozen, livers, roes and milt",8,Weight in kilograms,124,,,,124,,3490,,,0
H5,2020,2020,2020,6,1,1,Import,410,Rep. of Korea,KOR,392,Japan,JPN,,,,,,,,30399,"Fish; frozen, fish fins (other than shark fins), heads, tails, maws and other edible fish offal",8,Weight in kilograms,5894,,,,5894,,17092,,,0
H5,2020,2020,2020,6,1,1,Import,410,Rep. of Korea,KOR,392,Japan,JPN,,,,,,,,30449,"Fish fillets; fresh or chilled, other than fish of heading 0304.4",8,Weight in kilograms,8,,,,8,,1,,,0
H5,2020,2020,2020,6,1,1,Import,410,Rep. of Korea,KOR,392,Japan,JPN,,,,,,,,30461,"Fish fillets; frozen, tilapias (Oreochromis spp.)",8,Weight in kilograms,1,,,,1,,12,,,0
H5,2020,2020,2020,6,1,1,Import,410,Rep. of Korea,KOR,392,Japan,JPN,,,,,,,,30481,"Fish fillets; frozen, salmon, Pacific (Oncorhynchus nerka, Oncorhynchus gorbuscha, Oncorhynchus keta, Oncorhynchus tschawytscha, Oncorhynchus kisutch, Oncorhynchus masou, Oncorhynchus rhodurus), Atlantic (Salmo salar), and Danube (Hucho hucho)",8,Weight in kilograms,3,,,,3,,23,,,0
H5,2020,2020,2020,6,1,1,Import,410,Rep. of Korea,KOR,392,Japan,JPN,,,,,,,,30484,"Fish fillets; frozen, swordfish (Xiphias gladius)",8,Weight in kilograms,22027,,,,22027,,421355,,,0
H5,2020,2020,2020,6,1,1,Import,410,Rep. of Korea,KOR,392,Japan,JPN,,,,,,,,30487,"Fish fillets; frozen, tunas (of the genus Thunnus), skipjack or stripe-bellied bonito (Euthynnus (Katsuwonus) pelamis)",8,Weight in kilograms,107680,,,,107680,,1302259,,,0
H5,2020,2020,2020,6,1,1,Import,410,Rep. of Korea,KOR,392,Japan,JPN,,,,,,,,30489,"Fish fillets; frozen, of fish n.e.c. in heading 0304.8",8,Weight in kilograms,67965,,,,67965,,994410,,,0
H5,2020,2020,2020,6,1,1,Import,410,Rep. of Korea,KOR,392,Japan,JPN,,,,,,,,30510,"Fish; flours, meals and pellets, fit for human consumption",8,Weight in kilograms,617,,,,617,,11848,,,0
H5,2020,2020,2020,6,1,1,Import,410,Rep. of Korea,KOR,392,Japan,JPN,,,,,,,,30520,"Fish; livers, roes and milt of fish, dried, smoked, salted or in brine",8,Weight in kilograms,266,,,,266,,14498,,,0
H5,2020,2020,2020,6,1,1,Import,410,Rep. of Korea,KOR,392,Japan,JPN,,,,,,,,30541,"Fish; smoked, whether or not cooked before or during smoking, salmon, Pacific (Oncorhynchus nerka, gorbuscha, keta, tschawytscha, kisutch, masou, rhodurus), Atlantic (Salmo salar) and Danube (Hucho hucho), includes fillets, but excludes edible fish offal",8,Weight in kilograms,2,,,,2,,54,,,0
H5,2020,2020,2020,6,1,1,Import,410,Rep. of Korea,KOR,392,Japan,JPN,,,,,,,,30549,"Fish; smoked, whether or not cooked before or during smoking, n.e.c. in item no. 0305.4, includes fillets, but excludes edible fish offal",8,Weight in kilograms,24138,,,,24138,,528222,,,0
H5,2020,2020,2020,6,1,1,Import,410,Rep. of Korea,KOR,392,Japan,JPN,,,,,,,,30551,"Fish; dried, whether or not salted but not smoked, other than edible fish offal, cod (Gadus morhua, Gadus ogac, Gadus macrocephalus)",8,Weight in kilograms,20,,,,20,,644,,,0
H5,2020,2020,2020,6,1,1,Import,410,Rep. of Korea,KOR,392,Japan,JPN,,,,,,,,30554,"Dried herrings, anchovies, sardines, sardinella, brisling or sprats, mackerel (incl Indian, jack, or horse), seerfishes, jacks, crevalles, cobia, silver pomfrets, Pacific saury, scads, capelin, swordfish, Kawakawa, bonitos, marlins, sailfishes, spearfish",8,Weight in kilograms,56,,,,56,,1958,,,0
H5,2020,2020,2020,6,1,1,Import,410,Rep. of Korea,KOR,392,Japan,JPN,,,,,,,,30559,"Fish; dried, whether or not salted but not smoked, other than edible fish offal, n.e.c. in item no. 0305.5",8,Weight in kilograms,4648,,,,4648,,31227,,,6
H5,2020,2020,2020,6,1,1,Import,410,Rep. of Korea,KOR,392,Japan,JPN,,,,,,,,30569,"Fish; salted or in brine, not dried or smoked, other than edible fish offal, n.e.c. in item no. 0305.6",8,Weight in kilograms,9,,,,9,,182,,,0
H5,2020,2020,2020,6,1,1,Import,410,Rep. of Korea,KOR,392,Japan,JPN,,,,,,,,30572,"Fish; edible offal, fish heads, tails and maws",8,Weight in kilograms,2,,,,2,,404,,,0
H5,2020,2020,2020,6,1,1,Import,410,Rep. of Korea,KOR,392,Japan,JPN,,,,,,,,30614,"Crustaceans; frozen, crabs, in shell or not, smoked, cooked or not before or during smoking; in shell, cooked by steaming or by boiling in water",8,Weight in kilograms,120,,,,120,,1794,,,0
H5,2020,2020,2020,6,1,1,Import,410,Rep. of Korea,KOR,392,Japan,JPN,,,,,,,,30617,"Crustaceans; frozen, shrimps and prawns, excluding cold-water varieties, in shell or not, smoked, cooked or not before or during smoking; in shell, cooked by steaming or by boiling in water",8,Weight in kilograms,13557,,,,13557,,187036,,,0
H5,2020,2020,2020,6,1,1,Import,410,Rep. of Korea,KOR,392,Japan,JPN,,,,,,,,30631,"Crustaceans; live, fresh or chilled, rock lobsters and other sea crawfish (Palinurus spp., Panulirus spp., Jasus spp.), in shell or not",8,Weight in kilograms,5,,,,5,,1163,,,0
H5,2020,2020,2020,6,1,1,Import,410,Rep. of Korea,KOR,392,Japan,JPN,,,,,,,,30633,"Crustaceans; live, fresh or chilled, crabs, whether in shell or not",8,Weight in kilograms,14437,,,,14437,,154795,,,0
H5,2020,2020,2020,6,1,1,Import,410,Rep. of Korea,KOR,392,Japan,JPN,,,,,,,,30639,"Crustaceans; live, fresh or chilled, n.e.c. in item no. 0306.3, in shell or not, including edible flours, meals, and pellets of crustaceans",8,Weight in kilograms,2,,,,2,,5615,,,0
H5,2020,2020,2020,6,1,1,Import,410,Rep. of Korea,KOR,392,Japan,JPN,,,,,,,,30712,"Molluscs; oysters, whether in shell or not, frozen",8,Weight in kilograms,2,,,,2,,12,,,0
H5,2020,2020,2020,6,1,1,Import,410,Rep. of Korea,KOR,392,Japan,JPN,,,,,,,,30721,"Molluscs; scallops, whether in shell or not, including queen scallops, of the genera Pecten, Chlamys or Placopecten, live, fresh or chilled",8,Weight in kilograms,8519622,,,,8519622,,28018845,,,0
H5,2020,2020,2020,6,1,1,Import,410,Rep. of Korea,KOR,392,Japan,JPN,,,,,,,,30722,"Molluscs; scallops, whether in shell or not, including queen scallops of the genera Pecten, Chlamys or Placopecten, frozen",8,Weight in kilograms,179635,,,,179635,,737976,,,0
H5,2020,2020,2020,6,1,1,Import,410,Rep. of Korea,KOR,392,Japan,JPN,,,,,,,,30729,"Molluscs; scallops, whether in shell or not, including queen scallops of the genera Pecten, Chlamys or Placopecten, dried, salted, in brine, or smoked, cooked or not before or during the smoking process",8,Weight in kilograms,421,,,,421,,53737,,,6
H5,2020,2020,2020,6,1,1,Import,410,Rep. of Korea,KOR,392,Japan,JPN,,,,,,,,30742,"Molluscs; cuttle fish and squid, whether in shell or not, live, fresh or chilled",8,Weight in kilograms,9,,,,9,,8,,,0
H5,2020,2020,2020,6,1,1,Import,410,Rep. of Korea,KOR,392,Japan,JPN,,,,,,,,30743,"Molluscs; cuttle fish and squid, whether in shell or not, includes flours, meals, and pellets of molluscs, fit for human consumption, frozen",8,Weight in kilograms,45286,,,,45286,,193733,,,0
H5,2020,2020,2020,6,1,1,Import,410,Rep. of Korea,KOR,392,Japan,JPN,,,,,,,,30749,"Molluscs; cuttle fish and squid, whether in shell or not, includes flours, meals, and pellets of molluscs, fit for human consumption, dried, salted, in brine, or smoked, cooked or not before or during the smoking process",8,Weight in kilograms,46,,,,46,,2339,,,0
H5,2020,2020,2020,6,1,1,Import,410,Rep. of Korea,KOR,392,Japan,JPN,,,,,,,,30751,"Molluscs; octopus (Octopus spp.), live, fresh or chilled",8,Weight in kilograms,3912,,,,3912,,33451,,,0
H5,2020,2020,2020,6,1,1,Import,410,Rep. of Korea,KOR,392,Japan,JPN,,,,,,,,30752,"Molluscs; octopus (Octopus spp.), frozen",8,Weight in kilograms,23270,,,,23270,,116318,,,0
H5,2020,2020,2020,6,1,1,Import,410,Rep. of Korea,KOR,392,Japan,JPN,,,,,,,,30771,"Molluscs; clams, cockles and ark shells (families Arcidae, Arcticidae, Cardiidae, Donacidae, Hiatellidae, Mactridae, Mesodesmatidae, Myidae, Semelidae, Solecurtidae, Solenidae, Tridacnidae and Veneridae), whether in shell or not, live, fresh or chilled",8,Weight in kilograms,318175,,,,318175,,1079789,,,0
H5,2020,2020,2020,6,1,1,Import,410,Rep. of Korea,KOR,392,Japan,JPN,,,,,,,,30779,"Molluscs; clams, cockle, ark shells (families Arcidae, Arcticidae, Cardiidae, Donacidae, Hiatellidae, Mactridae, Mesodesmatidae, Myidae, Semelidae, Solecurtidae, Solenidae, Tridacnidae, Veneridae), whether in shell or not, dried, salted, in brine, smoked",8,Weight in kilograms,2,,,,2,,157,,,0
H5,2020,2020,2020,6,1,1,Import,410,Rep. of Korea,KOR,392,Japan,JPN,,,,,,,,30791,"Molluscs; n.e.c. in heading 0307, whether in shell or not, includes flours, meals, and pellets of molluscs, fit for human consumption, live or fresh, chilled",8,Weight in kilograms,3800,,,,3800,,10712,,,0
H5,2020,2020,2020,6,1,1,Import,410,Rep. of Korea,KOR,392,Japan,JPN,,,,,,,,30792,"Molluscs; n.e.c. in heading 0307, whether in shell or not, includes flours, meals, and pellets of molluscs, fit for human consumption, frozen",8,Weight in kilograms,123196,,,,123196,,1940247,,,0
H5,2020,2020,2020,6,1,1,Import,410,Rep. of Korea,KOR,392,Japan,JPN,,,,,,,,30799,"Molluscs; n.e.c. in heading 0307, whether in shell or not, includes flours, meals, and pellets of molluscs, fit for human consumption, dried, salted, in brine, or smoked, cooked or not before or during the smoking process",8,Weight in kilograms,80,,,,80,,2703,,,0
H5,2020,2020,2020,6,1,1,Import,410,Rep. of Korea,KOR,392,Japan,JPN,,,,,,,,30811,"Aquatic invertebrates; sea cucumbers (Stichopus japonicus, Holothuroidea), live, fresh or chilled",8,Weight in kilograms,3004,,,,3004,,28371,,,0
H5,2020,2020,2020,6,1,1,Import,410,Rep. of Korea,KOR,392,Japan,JPN,,,,,,,,30821,"Aquatic invertebrates; sea urchins (Strongylocentrotus spp., Paracentrotus lividus, Loxechinus albus, Echinus esculentus), live, fresh or chilled",8,Weight in kilograms,10,,,,10,,1534,,,0
H5,2020,2020,2020,6,1,1,Import,410,Rep. of Korea,KOR,392,Japan,JPN,,,,,,,,30830,"Aquatic invertebrates; jellyfish (Rhopilema spp.), live, fresh, chilled, frozen, dried, salted or in brine, smoked, whether or not cooked before or during smoking",8,Weight in kilograms,5,,,,5,,2569,,,0
H5,2020,2020,2020,6,1,1,Import,410,Rep. of Korea,KOR,392,Japan,JPN,,,,,,,,30890,"Aquatic invertebrates; other than crustaceans, molluscs, sea urchins, sea cucumbers and jellyfish, live, fresh, chilled, frozen, dried, salted or in brine, smoked, cooked or not before or during smoking, includes edible flours, meals, and pellets",8,Weight in kilograms,3540410,,,,3540410,,8305802,,,0
H5,2020,2020,2020,6,1,1,Import,410,Rep. of Korea,KOR,392,Japan,JPN,,,,,,,,40110,"Dairy produce; milk and cream, not concentrated, not containing added sugar or other sweetening matter, of a fat content, by weight, not exceeding 1%",8,Weight in kilograms,6,,,,6,,81,,,0
H5,2020,2020,2020,6,1,1,Import,410,Rep. of Korea,KOR,392,Japan,JPN,,,,,,,,40120,"Dairy produce; milk and cream, not concentrated, not containing added sugar or other sweetening matter, of a fat content, by weight, exceeding 1% but not exceeding 6%",8,Weight in kilograms,9,,,,9,,91,,,0
H5,2020,2020,2020,6,1,1,Import,410,Rep. of Korea,KOR,392,Japan,JPN,,,,,,,,40140,"Dairy produce; milk and cream, not concentrated, not containing added sugar or other sweetening matter, of a fat content, by weight, exceeding 6% but not exceeding 10%",8,Weight in kilograms,11,,,,11,,94,,,0
H5,2020,2020,2020,6,1,1,Import,410,Rep. of Korea,KOR,392,Japan,JPN,,,,,,,,40150,"Dairy produce; milk and cream, not concentrated, not containing added sugar or other sweetening matter, of a fat content, by weight, exceeding 10%",8,Weight in kilograms,35,,,,35,,221,,,0
H5,2020,2020,2020,6,1,1,Import,410,Rep. of Korea,KOR,392,Japan,JPN,,,,,,,,40210,"Dairy produce; milk and cream, concentrated or containing added sugar or other sweetening matter, in powder, granules or other solid forms, of a fat content not exceeding 1.5% (by weight)",8,Weight in kilograms,32,,,,32,,319,,,0
H5,2020,2020,2020,6,1,1,Import,410,Rep. of Korea,KOR,392,Japan,JPN,,,,,,,,40221,"Dairy produce; milk and cream, concentrated, not containing added sugar or other sweetening matter, in powder, granules or other solid forms, of a fat content exceeding 1.5% (by weight)",8,Weight in kilograms,8,,,,8,,169,,,0
H5,2020,2020,2020,6,1,1,Import,410,Rep. of Korea,KOR,392,Japan,JPN,,,,,,,,40229,"Dairy produce; milk and cream, containing added sugar or other sweetening matter, in powder, granules or other solid forms, of a fat content exceeding 1.5% (by weight)",8,Weight in kilograms,2,,,,2,,70,,,6
H5,2020,2020,2020,6,1,1,Import,410,Rep. of Korea,KOR,392,Japan,JPN,,,,,,,,40299,"Dairy produce; milk and cream, containing added sugar or other sweetening matter, other than in powder, granules or other solid forms",8,Weight in kilograms,3160,,,,3160,,4885,,,0
H5,2020,2020,2020,6,1,1,Import,410,Rep. of Korea,KOR,392,Japan,JPN,,,,,,,,40310,"Dairy produce; yoghurt, whether or not concentrated or containing added sugar or other sweetening matter or flavoured or containing added fruit or cocoa",8,Weight in kilograms,45,,,,45,,1237,,,6
H5,2020,2020,2020,6,1,1,Import,410,Rep. of Korea,KOR,392,Japan,JPN,,,,,,,,40390,"Dairy produce; buttermilk, curdled milk or cream, kephir, fermented or acidified milk or cream, whether or not concentrated or containing added sweetening, flavouring, fruit or cocoa (excluding yoghurt)",8,Weight in kilograms,6,,,,6,,63,,,0
H5,2020,2020,2020,6,1,1,Import,410,Rep. of Korea,KOR,392,Japan,JPN,,,,,,,,40490,"Dairy produce; natural milk constituents (excluding whey), whether or not containing added sugar or other sweetening matter, n.e.c. in chapter 04",8,Weight in kilograms,1250,,,,1250,,33481,,,0
H5,2020,2020,2020,6,1,1,Import,410,Rep. of Korea,KOR,392,Japan,JPN,,,,,,,,40510,"Dairy produce; derived from milk, butter",8,Weight in kilograms,28,,,,28,,871,,,6
H5,2020,2020,2020,6,1,1,Import,410,Rep. of Korea,KOR,392,Japan,JPN,,,,,,,,40520,Dairy produce; dairy spreads,8,Weight in kilograms,1,,,,1,,7,,,6
H5,2020,2020,2020,6,1,1,Import,410,Rep. of Korea,KOR,392,Japan,JPN,,,,,,,,40610,"Dairy produce; fresh cheese (including whey cheese), not fermented, and curd",8,Weight in kilograms,5675,,,,5675,,57326,,,6
H5,2020,2020,2020,6,1,1,Import,410,Rep. of Korea,KOR,392,Japan,JPN,,,,,,,,40620,"Dairy produce; cheese of all kinds, grated or powdered",8,Weight in kilograms,2,,,,2,,37,,,0
H5,2020,2020,2020,6,1,1,Import,410,Rep. of Korea,KOR,392,Japan,JPN,,,,,,,,40630,"Dairy produce; cheese, processed (not grated or powdered)",8,Weight in kilograms,154,,,,154,,3525,,,6
H5,2020,2020,2020,6,1,1,Import,410,Rep. of Korea,KOR,392,Japan,JPN,,,,,,,,40690,"Dairy produce; cheese (not grated, powdered or processed), n.e.c. in heading no. 0406",8,Weight in kilograms,2311,,,,2311,,52798,,,6
H5,2020,2020,2020,6,1,1,Import,410,Rep. of Korea,KOR,392,Japan,JPN,,,,,,,,40729,"Birds' eggs, in shell; fresh, not for incubation, other than fowls of the species Gallus domesticus (domestic hens)",8,Weight in kilograms,0,,,,0,,1,,,6
H5,2020,2020,2020,6,1,1,Import,410,Rep. of Korea,KOR,392,Japan,JPN,,,,,,,,40899,"Eggs; birds' eggs (not in shell, excluding yolks only), fresh, cooked by steaming or boiling in water, moulded, frozen, otherwise preserved, whether or not containing added sugar or other sweetening matter",8,Weight in kilograms,0,,,,0,,2,,,6
H5,2020,2020,2020,6,1,1,Import,410,Rep. of Korea,KOR,392,Japan,JPN,,,,,,,,40900,Honey; natural,8,Weight in kilograms,50,,,,50,,2334,,,0
H5,2020,2020,2020,6,1,1,Import,410,Rep. of Korea,KOR,392,Japan,JPN,,,,,,,,41000,"Animal products; edible, n.e.c. in this or other chapters",8,Weight in kilograms,4,,,,4,,362,,,6
H5,2020,2020,2020,6,1,1,Import,410,Rep. of Korea,KOR,392,Japan,JPN,,,,,,,,50100,"Animal products; hair, human, unworked, whether or not washed or scoured, and waste of human hair",8,Weight in kilograms,3,,,,3,,1002,,,6
H5,2020,2020,2020,6,1,1,Import,410,Rep. of Korea,KOR,392,Japan,JPN,,,,,,,,50710,"Animal products; ivory, unworked or simply prepared but not cut to shape, ivory powder and waste",8,Weight in kilograms,13,,,,13,,20,,,6
H5,2020,2020,2020,6,1,1,Import,410,Rep. of Korea,KOR,392,Japan,JPN,,,,,,,,50800,"Animal products; coral and similar materials, shells of molluscs, crustaceans, echinoderms, cuttle-bone, unworked or simply prepared but not cut to shape, powder and waste thereof",8,Weight in kilograms,1363797,,,,1363797,,273471,,,0
