H5,2020,2020,2020,6,1,1,Import,410,Rep. of Korea,KOR,392,Japan,JPN,,,,,,,,841410,Pumps; vacuum,5,Number of items,56779,,,,2148062,,128404143,,,0
H5,2020,2020,2020,6,1,1,Import,410,Rep. of Korea,KOR,392,Japan,JPN,,,,,,,,841420,Pumps; hand or foot-operated air pumps,5,Number of items,665,,,,184,,48967,,,0
H5,2020,2020,2020,6,1,1,Import,410,Rep. of Korea,KOR,392,Japan,JPN,,,,,,,,841430,Compressors; of a kind used in refrigerating equipment,5,Number of items,59255,,,,942043,,20620136,,,0
H5,2020,2020,2020,6,1,1,Import,410,Rep. of Korea,KOR,392,Japan,JPN,,,,,,,,841440,Compressors; air compressors mounted on a wheeled chassis for towing,5,Number of items,3681,,,,21414,,560862,,,0
H5,2020,2020,2020,6,1,1,Import,410,Rep. of Korea,KOR,392,Japan,JPN,,,,,,,,841451,"Fans; table, floor, wall, window, ceiling or roof fans, with a self-contained electric motor of an output not exceeding 125W",5,Number of items,14874,,,,52042,,1404448,,,0
H5,2020,2020,2020,6,1,1,Import,410,Rep. of Korea,KOR,392,Japan,JPN,,,,,,,,841459,Fans; n.e.c. in item no. 8414.51,5,Number of items,130816,,,,359810,,11269620,,,0
H5,2020,2020,2020,6,1,1,Import,410,Rep. of Korea,KOR,392,Japan,JPN,,,,,,,,841460,"Hoods; ventilating or recycling hoods incorporating a fan, whether or not fitted with filters, having a maximum horizontal side not exceeding 120cm",5,Number of items,24,,,,110,,3616,,,0
H5,2020,2020,2020,6,1,1,Import,410,Rep. of Korea,KOR,392,Japan,JPN,,,,,,,,841480,"Pumps and compressors; for air, vacuum or gas, n.e.c. in heading no. 8414",5,Number of items,208113,,,,6923691,,229134346,,,0
H5,2020,2020,2020,6,1,1,Import,410,Rep. of Korea,KOR,392,Japan,JPN,,,,,,,,841490,"Pumps and compressors; parts, of air or vacuum pumps, air or other gas compressors and fans, ventilating or recycling hoods incorporating a fan",8,Weight in kilograms,1313045,,,,1313045,,104181229,,,0
H5,2020,2020,2020,6,1,1,Import,410,Rep. of Korea,KOR,392,Japan,JPN,,,,,,,,841510,"Air conditioning machines; comprising a motor-driven fan and elements for changing the temperature and humidity, of a kind designed to be fixed to a window, wall, ceiling or floor, self-contained or split-system",5,Number of items,950,,,,54386,,1069561,,,0
H5,2020,2020,2020,6,1,1,Import,410,Rep. of Korea,KOR,392,Japan,JPN,,,,,,,,841520,"Air conditioning machines; comprising a motor driven fan and elements for changing the temperature and humidity, of a kind used for persons, in motor vehicles",5,Number of items,45,,,,92,,14452,,,0
H5,2020,2020,2020,6,1,1,Import,410,Rep. of Korea,KOR,392,Japan,JPN,,,,,,,,841581,"Air conditioning machines; containing a motor driven fan, other than window or wall types, incorporating a refrigerating unit and a valve for reversal of the cooling/heat cycle (reversible heat pumps)",5,Number of items,23,,,,3686,,12635,,,0
H5,2020,2020,2020,6,1,1,Import,410,Rep. of Korea,KOR,392,Japan,JPN,,,,,,,,841582,"Air conditioning machines; containing a motor driven fan, other than window or wall types, incorporating a refrigerating unit",5,Number of items,16,,,,16358,,378680,,,0
H5,2020,2020,2020,6,1,1,Import,410,Rep. of Korea,KOR,392,Japan,JPN,,,,,,,,841583,"Air conditioning machines; containing a motor driven fan, other than window or wall types, not incorporating a refrigerating unit",5,Number of items,195,,,,422,,33290,,,0
H5,2020,2020,2020,6,1,1,Import,410,Rep. of Korea,KOR,392,Japan,JPN,,,,,,,,841590,"Air conditioning machines; with motor driven fan and elements for temperature control, parts thereof",8,Weight in kilograms,3082453,,,,3082453,,42001417,,,0
H5,2020,2020,2020,6,1,1,Import,410,Rep. of Korea,KOR,392,Japan,JPN,,,,,,,,841610,"Furnaces; furnace burners, for liquid fuel",8,Weight in kilograms,233,,,,233,,22081,,,6
H5,2020,2020,2020,6,1,1,Import,410,Rep. of Korea,KOR,392,Japan,JPN,,,,,,,,841620,"Furnaces; furnace burners, for pulverized solid fuel or gas, including combination burners",8,Weight in kilograms,304050,,,,304050,,8046422,,,0
H5,2020,2020,2020,6,1,1,Import,410,Rep. of Korea,KOR,392,Japan,JPN,,,,,,,,841630,"Furnace accessories; mechanical stokers, mechanical grates, mechanical ash dischargers and similar appliances",8,Weight in kilograms,1,,,,1,,131,,,0
H5,2020,2020,2020,6,1,1,Import,410,Rep. of Korea,KOR,392,Japan,JPN,,,,,,,,841690,"Furnaces; parts of furnace burners, for liquid fuel, pulverized solid fuel or gas, mechanical stokers, grates, ash dischargers and the like",8,Weight in kilograms,223514,,,,223514,,11780646,,,0
H5,2020,2020,2020,6,1,1,Import,410,Rep. of Korea,KOR,392,Japan,JPN,,,,,,,,841710,"Furnaces and ovens; non-electric, for the roasting, melting or other heat-treatment of ores, pyrites or of metals, for industrial or laboratory use",5,Number of items,2,,,,7,,817,,,0
H5,2020,2020,2020,6,1,1,Import,410,Rep. of Korea,KOR,392,Japan,JPN,,,,,,,,841720,"Ovens; non-electric, bakery ovens, including biscuit ovens",5,Number of items,16,,,,10243,,318523,,,0
H5,2020,2020,2020,6,1,1,Import,410,Rep. of Korea,KOR,392,Japan,JPN,,,,,,,,841780,"Furnaces and ovens; including incinerators, non-electric, for industrial or laboratory use, n.e.c. in heading no. 8417",5,Number of items,81,,,,84144,,3105380,,,0
H5,2020,2020,2020,6,1,1,Import,410,Rep. of Korea,KOR,392,Japan,JPN,,,,,,,,841790,"Furnaces and ovens; parts of non-electric furnaces and ovens (including incinerators), of industrial or laboratory use",8,Weight in kilograms,164216,,,,164216,,7416657,,,6
H5,2020,2020,2020,6,1,1,Import,410,Rep. of Korea,KOR,392,Japan,JPN,,,,,,,,841810,"Refrigerators and freezers; combined refrigerator-freezers, fitted with separate external doors, electric or other",5,Number of items,214,,,,7572,,193921,,,0
H5,2020,2020,2020,6,1,1,Import,410,Rep. of Korea,KOR,392,Japan,JPN,,,,,,,,841821,"Refrigerators; for household use, compression-type, electric or other",5,Number of items,2,,,,158,,5324,,,0
H5,2020,2020,2020,6,1,1,Import,410,Rep. of Korea,KOR,392,Japan,JPN,,,,,,,,841829,"Refrigerators; household, electric or not, other than compression-type",5,Number of items,14,,,,212,,6055,,,0
H5,2020,2020,2020,6,1,1,Import,410,Rep. of Korea,KOR,392,Japan,JPN,,,,,,,,841830,"Freezers; of the chest type, not exceeding 800l capacity",5,Number of items,3,,,,809,,23273,,,0
H5,2020,2020,2020,6,1,1,Import,410,Rep. of Korea,KOR,392,Japan,JPN,,,,,,,,841840,"Freezers; of the upright type, not exceeding 900l capacity",5,Number of items,114,,,,29513,,569177,,,0
H5,2020,2020,2020,6,1,1,Import,410,Rep. of Korea,KOR,392,Japan,JPN,,,,,,,,841850,"Furniture incorporating refrigerating or freezing equipment; for storage and display, n.e.c. in item no. 8418.1, 8418.2, 8418.3 or 8418.4 (chests, cabinets, display counters, show-cases and the like)",5,Number of items,11,,,,1262,,23691,,,0
H5,2020,2020,2020,6,1,1,Import,410,Rep. of Korea,KOR,392,Japan,JPN,,,,,,,,841861,Heat pumps; other than air conditioning machines of heading no. 8415,5,Number of items,109,,,,100340,,2352982,,,0
H5,2020,2020,2020,6,1,1,Import,410,Rep. of Korea,KOR,392,Japan,JPN,,,,,,,,841869,Refrigerating or freezing equipment; n.e.c. in heading no. 8418,8,Weight in kilograms,328502,,,,328502,,7603068,,,0
H5,2020,2020,2020,6,1,1,Import,410,Rep. of Korea,KOR,392,Japan,JPN,,,,,,,,841899,"Refrigerating or freezing equipment; parts thereof, other than furniture",8,Weight in kilograms,106648,,,,106648,,3649400,,,0
H5,2020,2020,2020,6,1,1,Import,410,Rep. of Korea,KOR,392,Japan,JPN,,,,,,,,841911,"Heaters; instantaneous gas water heaters, for domestic or other purposes",5,Number of items,223,,,,7168,,185317,,,0
H5,2020,2020,2020,6,1,1,Import,410,Rep. of Korea,KOR,392,Japan,JPN,,,,,,,,841919,"Heaters; instantaneous or storage water heaters, non-electric, other than instantaneous gas water heaters",5,Number of items,23,,,,885,,260738,,,0
H5,2020,2020,2020,6,1,1,Import,410,Rep. of Korea,KOR,392,Japan,JPN,,,,,,,,841920,"Sterilizers; for medical, surgical or laboratory use, not used for domestic purposes",5,Number of items,213,,,,33966,,1582602,,,0
H5,2020,2020,2020,6,1,1,Import,410,Rep. of Korea,KOR,392,Japan,JPN,,,,,,,,841931,"Dryers; for agricultural products, not used for domestic purposes",5,Number of items,5,,,,4893,,426036,,,0
H5,2020,2020,2020,6,1,1,Import,410,Rep. of Korea,KOR,392,Japan,JPN,,,,,,,,841939,"Dryers; for products n.e.c. in heading no. 8419, not used for domestic purposes",5,Number of items,902,,,,168891,,11002431,,,0
H5,2020,2020,2020,6,1,1,Import,410,Rep. of Korea,KOR,392,Japan,JPN,,,,,,,,841940,Distilling or rectifying plant; not used for domestic purposes,5,Number of items,28,,,,57805,,3077384,,,0
H5,2020,2020,2020,6,1,1,Import,410,Rep. of Korea,KOR,392,Japan,JPN,,,,,,,,841950,Heat exchange units; not used for domestic purposes,5,Number of items,100137,,,,467614,,15902908,,,0
H5,2020,2020,2020,6,1,1,Import,410,Rep. of Korea,KOR,392,Japan,JPN,,,,,,,,841960,"Machinery; for liquefying air or gas, not used for domestic purposes",5,Number of items,2,,,,1780,,49707,,,0
H5,2020,2020,2020,6,1,1,Import,410,Rep. of Korea,KOR,392,Japan,JPN,,,,,,,,841981,"Machinery, plant and equipment; for making hot drinks, for cooking or heating food",5,Number of items,248,,,,107533,,6147859,,,0
H5,2020,2020,2020,6,1,1,Import,410,Rep. of Korea,KOR,392,Japan,JPN,,,,,,,,841989,"Machinery, plant and laboratory equipment; for treating materials by change of temperature, other than for making hot drinks or cooking or heating food",5,Number of items,21710,,,,2454627,,71936012,,,0
H5,2020,2020,2020,6,1,1,Import,410,Rep. of Korea,KOR,392,Japan,JPN,,,,,,,,841990,"Machinery, plant and laboratory equipment; parts of equipment for treating materials by a process involving a change of temperature",8,Weight in kilograms,797234,,,,797234,,30410345,,,0
H5,2020,2020,2020,6,1,1,Import,410,Rep. of Korea,KOR,392,Japan,JPN,,,,,,,,842010,"Machines; calendering or other rolling machines, for other than metal or glass",5,Number of items,669,,,,295436,,5638350,,,0
H5,2020,2020,2020,6,1,1,Import,410,Rep. of Korea,KOR,392,Japan,JPN,,,,,,,,842091,"Machines; parts, cylinders for calendering or other rolling machines, for other than metal or glass",8,Weight in kilograms,15721,,,,15721,,477492,,,0
H5,2020,2020,2020,6,1,1,Import,410,Rep. of Korea,KOR,392,Japan,JPN,,,,,,,,842099,"Machines; parts, (other than cylinders), for calendering or other rolling machines, for other than metal or glass",8,Weight in kilograms,19479,,,,19479,,1243972,,,0
H5,2020,2020,2020,6,1,1,Import,410,Rep. of Korea,KOR,392,Japan,JPN,,,,,,,,842111,Centrifuges; cream separators,5,Number of items,5,,,,84,,118842,,,0
H5,2020,2020,2020,6,1,1,Import,410,Rep. of Korea,KOR,392,Japan,JPN,,,,,,,,842119,"Centrifuges; n.e.c. in heading no. 8421, including centrifugal dryers (but not clothes-dryers)",5,Number of items,2070,,,,116777,,8004848,,,0
H5,2020,2020,2020,6,1,1,Import,410,Rep. of Korea,KOR,392,Japan,JPN,,,,,,,,842121,Machinery; for filtering or purifying water,5,Number of items,2025186,,,,777612,,38608461,,,0
H5,2020,2020,2020,6,1,1,Import,410,Rep. of Korea,KOR,392,Japan,JPN,,,,,,,,842122,Machinery; for filtering or purifying beverages other than water,5,Number of items,18149,,,,872,,56336,,,0
H5,2020,2020,2020,6,1,1,Import,410,Rep. of Korea,KOR,392,Japan,JPN,,,,,,,,842123,"Machinery; filtering or purifying machinery, oil or petrol filters for internal combustion engines",5,Number of items,338576,,,,203841,,4682861,,,0
H5,2020,2020,2020,6,1,1,Import,410,Rep. of Korea,KOR,392,Japan,JPN,,,,,,,,842129,"Machinery; for filtering or purifying liquids, n.e.c. in item no. 8421.2",5,Number of items,229978,,,,407548,,78650417,,,0
H5,2020,2020,2020,6,1,1,Import,410,Rep. of Korea,KOR,392,Japan,JPN,,,,,,,,842131,Machinery; intake air filters for internal combustion engines,5,Number of items,155837,,,,105272,,1720104,,,0
H5,2020,2020,2020,6,1,1,Import,410,Rep. of Korea,KOR,392,Japan,JPN,,,,,,,,842139,"Machinery; for filtering or purifying gases, other than intake air filters for internal combustion engines",5,Number of items,46391630,,,,1128087,,67013969,,,0
H5,2020,2020,2020,6,1,1,Import,410,Rep. of Korea,KOR,392,Japan,JPN,,,,,,,,842191,"Centrifuges; parts thereof, including parts for centrifugal dryers",8,Weight in kilograms,10903,,,,10903,,2093558,,,0
H5,2020,2020,2020,6,1,1,Import,410,Rep. of Korea,KOR,392,Japan,JPN,,,,,,,,842199,Machinery; parts for filtering or purifying liquids or gases,8,Weight in kilograms,927421,,,,927421,,83765086,,,0
H5,2020,2020,2020,6,1,1,Import,410,Rep. of Korea,KOR,392,Japan,JPN,,,,,,,,842211,Dish washing machines; of the household type,5,Number of items,3,,,,526,,8138,,,0
H5,2020,2020,2020,6,1,1,Import,410,Rep. of Korea,KOR,392,Japan,JPN,,,,,,,,842219,Dish washing machines; of other than household type,5,Number of items,45,,,,2739,,191861,,,4
H5,2020,2020,2020,6,1,1,Import,410,Rep. of Korea,KOR,392,Japan,JPN,,,,,,,,842220,Machinery; for cleaning or drying bottles or other containers,5,Number of items,16,,,,2575,,92061,,,0
H5,2020,2020,2020,6,1,1,Import,410,Rep. of Korea,KOR,392,Japan,JPN,,,,,,,,842230,"Machinery; for filling, closing, sealing, capsuling or labelling bottles, cans, bags or other containers, machinery for aerating beverages",5,Number of items,380,,,,293473,,26193804,,,0
H5,2020,2020,2020,6,1,1,Import,410,Rep. of Korea,KOR,392,Japan,JPN,,,,,,,,842240,Machinery; for packing or wrapping,5,Number of items,909,,,,266527,,28898702,,,0
H5,2020,2020,2020,6,1,1,Import,410,Rep. of Korea,KOR,392,Japan,JPN,,,,,,,,842290,Machinery; parts of machinery of heading no. 8422,8,Weight in kilograms,32581,,,,32581,,8237458,,,0
H5,2020,2020,2020,6,1,1,Import,410,Rep. of Korea,KOR,392,Japan,JPN,,,,,,,,842310,Weighing machines; personal (including baby scales) and household scales,5,Number of items,1242,,,,1062,,31560,,,0
H5,2020,2020,2020,6,1,1,Import,410,Rep. of Korea,KOR,392,Japan,JPN,,,,,,,,842320,Weighing machines; scales for continuous weighing of goods on conveyors,5,Number of items,77,,,,4961,,318082,,,0
H5,2020,2020,2020,6,1,1,Import,410,Rep. of Korea,KOR,392,Japan,JPN,,,,,,,,842330,"Weighing machines; constant weight scales and scales for discharging a predetermined weight of material into a bag or container, including hopper scales",5,Number of items,225,,,,56302,,6036382,,,0
H5,2020,2020,2020,6,1,1,Import,410,Rep. of Korea,KOR,392,Japan,JPN,,,,,,,,842381,Weighing machines; having a maximum weighing capacity not exceeding 30kg (excluding balances of a sensitivity of 5cg or better),5,Number of items,319,,,,2024,,77209,,,0
H5,2020,2020,2020,6,1,1,Import,410,Rep. of Korea,KOR,392,Japan,JPN,,,,,,,,842382,Weighing machines; having a maximum weighing capacity exceeding 30kg but not exceeding 5000kg,5,Number of items,300,,,,3600,,270797,,,0
H5,2020,2020,2020,6,1,1,Import,410,Rep. of Korea,KOR,392,Japan,JPN,,,,,,,,842389,Weighing machines; having a maximum weighing capacity exceeding 5000kg,5,Number of items,223,,,,8209,,897711,,,0
H5,2020,2020,2020,6,1,1,Import,410,Rep. of Korea,KOR,392,Japan,JPN,,,,,,,,842390,"Weighing machines; weights of all kinds, parts of weighing machinery",8,Weight in kilograms,16063,,,,16063,,2409665,,,0
H5,2020,2020,2020,6,1,1,Import,410,Rep. of Korea,KOR,392,Japan,JPN,,,,,,,,842410,Fire extinguishers; whether or not charged,5,Number of items,218,,,,4004,,595564,,,0
H5,2020,2020,2020,6,1,1,Import,410,Rep. of Korea,KOR,392,Japan,JPN,,,,,,,,842420,Spray guns and similar appliances,5,Number of items,1585586,,,,104064,,4431695,,,0
H5,2020,2020,2020,6,1,1,Import,410,Rep. of Korea,KOR,392,Japan,JPN,,,,,,,,842430,Mechanical appliances; steam or sand blasting machines and similar jet projecting machines,5,Number of items,1768,,,,60495,,2111387,,,0
H5,2020,2020,2020,6,1,1,Import,410,Rep. of Korea,KOR,392,Japan,JPN,,,,,,,,842441,Mechanical appliances; agricultural or horticultural sprayers; portable sprayers,5,Number of items,2964,,,,46372,,952940,,,0
H5,2020,2020,2020,6,1,1,Import,410,Rep. of Korea,KOR,392,Japan,JPN,,,,,,,,842449,Mechanical appliances; agricultural or horticultural sprayers; other than portable sprayers,5,Number of items,6204,,,,154192,,3864363,,,0
H5,2020,2020,2020,6,1,1,Import,410,Rep. of Korea,KOR,392,Japan,JPN,,,,,,,,842482,"Mechanical appliances; agricultural or horticultural, n.e.c. in heading 8424",5,Number of items,53976,,,,206682,,4111538,,,0
H5,2020,2020,2020,6,1,1,Import,410,Rep. of Korea,KOR,392,Japan,JPN,,,,,,,,842489,"Mechanical appliances; for projecting, dispersing or spraying liquids or powders, for other than agricultural or horticultural use, whether or not hand-operated",5,Number of items,612530,,,,76390,,5022325,,,0
H5,2020,2020,2020,6,1,1,Import,410,Rep. of Korea,KOR,392,Japan,JPN,,,,,,,,842490,"Mechanical appliances; parts of machines projecting, dispersing or spraying liquids or powders, whether or not hand-operated",8,Weight in kilograms,158132,,,,158132,,11281867,,,0
H5,2020,2020,2020,6,1,1,Import,410,Rep. of Korea,KOR,392,Japan,JPN,,,,,,,,842511,Pulley tackle and hoists; powered by an electric motor (excluding skip hoists or hoists of a kind used for raising vehicles),5,Number of items,4605,,,,73413,,1376730,,,0
H5,2020,2020,2020,6,1,1,Import,410,Rep. of Korea,KOR,392,Japan,JPN,,,,,,,,842519,Pulley tackle and hoists; not powered by an electric motor (excluding skip hoists or hoists of a kind used for raising vehicles),5,Number of items,2073,,,,29286,,624705,,,0
H5,2020,2020,2020,6,1,1,Import,410,Rep. of Korea,KOR,392,Japan,JPN,,,,,,,,842531,Winches; capstans; powered by an electric motor,5,Number of items,255,,,,569970,,3902798,,,0
H5,2020,2020,2020,6,1,1,Import,410,Rep. of Korea,KOR,392,Japan,JPN,,,,,,,,842539,Winches; capstans; not powered by an electric motor,5,Number of items,142,,,,343001,,1846544,,,0
H5,2020,2020,2020,6,1,1,Import,410,Rep. of Korea,KOR,392,Japan,JPN,,,,,,,,842541,"Jacks; built-in jacking systems of a type used in garages, for raising vehicles",5,Number of items,3,,,,4400,,6044,,,0
H5,2020,2020,2020,6,1,1,Import,410,Rep. of Korea,KOR,392,Japan,JPN,,,,,,,,842542,"Jacks and hoists; hydraulic, of a kind used for raising vehicles",5,Number of items,8774,,,,71206,,504120,,,0
H5,2020,2020,2020,6,1,1,Import,410,Rep. of Korea,KOR,392,Japan,JPN,,,,,,,,842549,"Jacks and hoists; (other than hydraulic), of a kind used for raising vehicles",5,Number of items,244,,,,11322,,450482,,,0
H5,2020,2020,2020,6,1,1,Import,410,Rep. of Korea,KOR,392,Japan,JPN,,,,,,,,842641,"Cranes; self-propelled derricks and cranes, on tyres, n.e.c. in heading no. 8426",5,Number of items,162,,,,4412775,,40222327,,,0
H5,2020,2020,2020,6,1,1,Import,410,Rep. of Korea,KOR,392,Japan,JPN,,,,,,,,842649,"Cranes; self-propelled derricks and cranes, not on tyres, n.e.c. in heading no. 8426",5,Number of items,32,,,,1689435,,9299478,,,0
H5,2020,2020,2020,6,1,1,Import,410,Rep. of Korea,KOR,392,Japan,JPN,,,,,,,,842699,"Cranes and derricks; for other than mounting on road vehicles, n.e.c. in heading no. 8426",5,Number of items,12,,,,94,,2228,,,0
H5,2020,2020,2020,6,1,1,Import,410,Rep. of Korea,KOR,392,Japan,JPN,,,,,,,,842710,"Fork-lift and other works trucks; fitted with lifting or handling equipment, self-propelled by electric motor",5,Number of items,9953,,,,26680770,,43530097,,,0
H5,2020,2020,2020,6,1,1,Import,410,Rep. of Korea,KOR,392,Japan,JPN,,,,,,,,842720,"Fork-lift and other works trucks; fitted with lifting or handling equipment, self-propelled by other than electric motor",5,Number of items,5254,,,,15010020,,20176072,,,0
H5,2020,2020,2020,6,1,1,Import,410,Rep. of Korea,KOR,392,Japan,JPN,,,,,,,,842790,"Fork-lift and other works trucks; fitted with lifting or handling equipment, not self-propelled",5,Number of items,736,,,,581326,,1147272,,,0
H5,2020,2020,2020,6,1,1,Import,410,Rep. of Korea,KOR,392,Japan,JPN,,,,,,,,842810,Lifts and skip hoists,5,Number of items,540,,,,797963,,7945164,,,0
H5,2020,2020,2020,6,1,1,Import,410,Rep. of Korea,KOR,392,Japan,JPN,,,,,,,,842820,Elevators and conveyors; pneumatic,5,Number of items,13,,,,677,,140647,,,0
H5,2020,2020,2020,6,1,1,Import,410,Rep. of Korea,KOR,392,Japan,JPN,,,,,,,,842832,"Elevators and conveyors; continuous-action, for goods or materials, bucket type, n.e.c. in item no. 8428.20 or 8428.31",5,Number of items,1,,,,531,,10101,,,0
H5,2020,2020,2020,6,1,1,Import,410,Rep. of Korea,KOR,392,Japan,JPN,,,,,,,,842833,"Elevators and conveyors; continuous-action, for goods or materials, belt type, n.e.c. in item no. 8428.20 or 8428.31",5,Number of items,1346,,,,38660,,2277162,,,0
H5,2020,2020,2020,6,1,1,Import,410,Rep. of Korea,KOR,392,Japan,JPN,,,,,,,,842839,"Elevators and conveyors; continuous-action, for goods or materials, n.e.c. in item no. 8428.20, 8428.31, 8428.32 or 8428.33",5,Number of items,284,,,,161975,,12358191,,,0
H5,2020,2020,2020,6,1,1,Import,410,Rep. of Korea,KOR,392,Japan,JPN,,,,,,,,842890,"Lifting, handling, loading or unloading machinery; n.e.c. in heading no. 8425, 8426, 8427 or 8428",5,Number of items,7610,,,,2925069,,63630238,,,0
H5,2020,2020,2020,6,1,1,Import,410,Rep. of Korea,KOR,392,Japan,JPN,,,,,,,,842911,"Bulldozers and angledozers; self-propelled, track laying",5,Number of items,2,,,,59456,,562141,,,0
H5,2020,2020,2020,6,1,1,Import,410,Rep. of Korea,KOR,392,Japan,JPN,,,,,,,,842919,"Bulldozers and angledozers; self-propelled, other than track laying",5,Number of items,107,,,,57058,,283315,,,0
H5,2020,2020,2020,6,1,1,Import,410,Rep. of Korea,KOR,392,Japan,JPN,,,,,,,,842920,Graders and levellers,5,Number of items,3,,,,50490,,629432,,,0
H5,2020,2020,2020,6,1,1,Import,410,Rep. of Korea,KOR,392,Japan,JPN,,,,,,,,842930,Scrapers; self-propelled,5,Number of items,10,,,,93,,887,,,6
H5,2020,2020,2020,6,1,1,Import,410,Rep. of Korea,KOR,392,Japan,JPN,,,,,,,,842940,Tamping machines and road rollers; self-propelled,5,Number of items,1039,,,,1492040,,11998264,,,0
H5,2020,2020,2020,6,1,1,Import,410,Rep. of Korea,KOR,392,Japan,JPN,,,,,,,,842951,Front-end shovel loaders,5,Number of items,22,,,,390432,,3432515,,,0
H5,2020,2020,2020,6,1,1,Import,410,Rep. of Korea,KOR,392,Japan,JPN,,,,,,,,842952,"Mechanical shovels, excavators and shovel loaders; with a 360 degree revolving super structure",5,Number of items,3416,,,,8593256,,65322231,,,0
H5,2020,2020,2020,6,1,1,Import,410,Rep. of Korea,KOR,392,Japan,JPN,,,,,,,,842959,"Mechanical shovels, excavators and shovel loaders; n.e.c. in item no. 8429.50",5,Number of items,220,,,,12257,,47109,,,0
H5,2020,2020,2020,6,1,1,Import,410,Rep. of Korea,KOR,392,Japan,JPN,,,,,,,,843010,Pile-drivers and pile-extractors,5,Number of items,167,,,,2279640,,21227534,,,0
H5,2020,2020,2020,6,1,1,Import,410,Rep. of Korea,KOR,392,Japan,JPN,,,,,,,,843039,Coal or rock cutters and tunnelling machinery; not self-propelled,5,Number of items,5,,,,95740,,394167,,,0
H5,2020,2020,2020,6,1,1,Import,410,Rep. of Korea,KOR,392,Japan,JPN,,,,,,,,843041,"Boring or sinking machinery; self-propelled, n.e.c. in heading no. 8430",5,Number of items,157,,,,322002,,4055919,,,0
H5,2020,2020,2020,6,1,1,Import,410,Rep. of Korea,KOR,392,Japan,JPN,,,,,,,,843049,Boring and sinking machinery; not self-propelled,5,Number of items,8,,,,109502,,424211,,,0
H5,2020,2020,2020,6,1,1,Import,410,Rep. of Korea,KOR,392,Japan,JPN,,,,,,,,843061,"Machinery; for tamping or compacting, not self-propelled",5,Number of items,103,,,,10070,,123200,,,0
H5,2020,2020,2020,6,1,1,Import,410,Rep. of Korea,KOR,392,Japan,JPN,,,,,,,,843069,"Machinery; for moving, levelling, scraping, grading, excavating earth minerals or ores; not self propelled n.e.c in 84.30",5,Number of items,3,,,,142,,2009,,,0
H5,2020,2020,2020,6,1,1,Import,410,Rep. of Korea,KOR,392,Japan,JPN,,,,,,,,843110,Machinery; parts of the machinery of heading no. 8425,8,Weight in kilograms,78848,,,,78848,,1018526,,,0
H5,2020,2020,2020,6,1,1,Import,410,Rep. of Korea,KOR,392,Japan,JPN,,,,,,,,843120,Machinery; parts of the machinery of heading no. 8427,8,Weight in kilograms,77977,,,,77977,,1637233,,,0
H5,2020,2020,2020,6,1,1,Import,410,Rep. of Korea,KOR,392,Japan,JPN,,,,,,,,843131,"Lifts, skip hoists or escalators; parts thereof",8,Weight in kilograms,401686,,,,401686,,3452640,,,0
H5,2020,2020,2020,6,1,1,Import,410,Rep. of Korea,KOR,392,Japan,JPN,,,,,,,,843139,"Machinery; parts of the machinery of heading no. 8428, (other than lifts, skip hoists or escalators)",8,Weight in kilograms,846131,,,,846131,,24324950,,,0
H5,2020,2020,2020,6,1,1,Import,410,Rep. of Korea,KOR,392,Japan,JPN,,,,,,,,843141,"Machinery parts; buckets, shovels, grabs and grips, for the machinery of heading no. 8426 and 8430",8,Weight in kilograms,48523,,,,48523,,1574108,,,0
H5,2020,2020,2020,6,1,1,Import,410,Rep. of Korea,KOR,392,Japan,JPN,,,,,,,,843142,Machinery parts; bulldozer or angledozer blades,8,Weight in kilograms,164,,,,164,,853,,,0
H5,2020,2020,2020,6,1,1,Import,410,Rep. of Korea,KOR,392,Japan,JPN,,,,,,,,843143,Boring or sinking machinery; parts of the machinery of item no. 8430.41 or 8430.41,8,Weight in kilograms,64908,,,,64908,,325585,,,0
H5,2020,2020,2020,6,1,1,Import,410,Rep. of Korea,KOR,392,Japan,JPN,,,,,,,,843149,"Machinery; parts of machines handling earth, minerals or ores and n.e.c. in heading no. 8431",8,Weight in kilograms,1564356,,,,1564356,,18673754,,,0
H5,2020,2020,2020,6,1,1,Import,410,Rep. of Korea,KOR,392,Japan,JPN,,,,,,,,843210,Ploughs; for soil preparation,5,Number of items,4,,,,4788,,79798,,,0
H5,2020,2020,2020,6,1,1,Import,410,Rep. of Korea,KOR,392,Japan,JPN,,,,,,,,843221,Harrows; disc harrows,5,Number of items,4,,,,109,,743,,,0
H5,2020,2020,2020,6,1,1,Import,410,Rep. of Korea,KOR,392,Japan,JPN,,,,,,,,843229,"Harrows; (excluding disc), scarifiers, cultivators, weeders and hoes",5,Number of items,2766,,,,80172,,1664603,,,0
H5,2020,2020,2020,6,1,1,Import,410,Rep. of Korea,KOR,392,Japan,JPN,,,,,,,,843231,"Seeders, planters and transplanters; no-till direct seeders, planters and transplanters",5,Number of items,33,,,,22013,,674083,,,0
