H5,2020,2020,2020,6,1,1,Import,410,Rep. of Korea,KOR,392,Japan,JPN,,,,,,,,330710,"Perfumery, cosmetic or toilet preparations; pre-shave, shaving or after-shave preparations",8,Weight in kilograms,6274,,,,6274,,86695,,,0
H5,2020,2020,2020,6,1,1,Import,410,Rep. of Korea,KOR,392,Japan,JPN,,,,,,,,330720,"Perfumery, cosmetic or toilet preparations; personal deodorants and antiperspirants",8,Weight in kilograms,7725,,,,7725,,601539,,,0
H5,2020,2020,2020,6,1,1,Import,410,Rep. of Korea,KOR,392,Japan,JPN,,,,,,,,330730,"Perfumery, cosmetic or toilet preparations; perfumed bath salts and other bath preparations",8,Weight in kilograms,423225,,,,423225,,6574354,,,0
H5,2020,2020,2020,6,1,1,Import,410,Rep. of Korea,KOR,392,Japan,JPN,,,,,,,,330741,"Perfumes and deodorizers; perfuming or deodorizing preparations for rooms, agarbatti and other odoriferous preparations which operate by burning (including those used during religious rites)",8,Weight in kilograms,40745,,,,40745,,1217241,,,0
H5,2020,2020,2020,6,1,1,Import,410,Rep. of Korea,KOR,392,Japan,JPN,,,,,,,,330749,"Perfumes and deodorizers; perfuming or deodorizing preparations for rooms, (excluding those which operate by burning)",8,Weight in kilograms,164679,,,,164679,,1327378,,,0
H5,2020,2020,2020,6,1,1,Import,410,Rep. of Korea,KOR,392,Japan,JPN,,,,,,,,330790,Perfumes and deodorizers; perfuming or deodorizing preparations n.e.c. in heading no. 3307,8,Weight in kilograms,213846,,,,213846,,3096705,,,0
H5,2020,2020,2020,6,1,1,Import,410,Rep. of Korea,KOR,392,Japan,JPN,,,,,,,,340111,"Soap and organic surface-active products; in the form of bars, cakes, moulded shapes, and paper, wadding, felt and nonwovens, impregnated, coated or covered with soap or detergent, for toilet use (including medicated products)",8,Weight in kilograms,61413,,,,61413,,920813,,,0
H5,2020,2020,2020,6,1,1,Import,410,Rep. of Korea,KOR,392,Japan,JPN,,,,,,,,340119,"Soap and organic surface-active products; in the form of bars, cakes, moulded shapes, and paper, wadding, felt and nonwovens, impregnated, coated or covered with soap or detergent, not for toilet use",8,Weight in kilograms,80054,,,,80054,,534903,,,0
H5,2020,2020,2020,6,1,1,Import,410,Rep. of Korea,KOR,392,Japan,JPN,,,,,,,,340120,Soap; in forms n.e.c. in item no. 3401.11,8,Weight in kilograms,46698,,,,46698,,443443,,,0
H5,2020,2020,2020,6,1,1,Import,410,Rep. of Korea,KOR,392,Japan,JPN,,,,,,,,340130,"Organic surface-active products and preparations for washing the skin, in the form of liquid or cream and put up for retail sale, whether or not containing soap",8,Weight in kilograms,256261,,,,256261,,4717896,,,0
H5,2020,2020,2020,6,1,1,Import,410,Rep. of Korea,KOR,392,Japan,JPN,,,,,,,,340211,"Organic surface-active agents; anionic (other than soap), whether or not put up for retail sale",8,Weight in kilograms,3300178,,,,3300178,,11705274,,,0
H5,2020,2020,2020,6,1,1,Import,410,Rep. of Korea,KOR,392,Japan,JPN,,,,,,,,340212,"Organic surface-active agents; cationic (other than soap), whether or not put up for retail sale",8,Weight in kilograms,113042,,,,113042,,1650323,,,0
H5,2020,2020,2020,6,1,1,Import,410,Rep. of Korea,KOR,392,Japan,JPN,,,,,,,,340213,"Organic surface-active agents; non-ionic (other than soap), whether or not put up for retail sale",8,Weight in kilograms,5314510,,,,5314510,,29143252,,,0
H5,2020,2020,2020,6,1,1,Import,410,Rep. of Korea,KOR,392,Japan,JPN,,,,,,,,340219,"Organic surface-active agents; whether or not put up for retail sale, n.e.c. in heading no. 3402",8,Weight in kilograms,137804,,,,137804,,930525,,,0
H5,2020,2020,2020,6,1,1,Import,410,Rep. of Korea,KOR,392,Japan,JPN,,,,,,,,340220,"Washing and cleaning preparations; surface-active, whether or not containing soap (excluding those of heading no. 3401), put up for retail sale",8,Weight in kilograms,485149,,,,485149,,4605989,,,0
H5,2020,2020,2020,6,1,1,Import,410,Rep. of Korea,KOR,392,Japan,JPN,,,,,,,,340290,"Washing and cleaning preparations; surface-active, whether or not containing soap (excluding those of heading no. 3401), including auxiliary washing preparations, not for retail sale",8,Weight in kilograms,1988709,,,,1988709,,18915784,,,0
H5,2020,2020,2020,6,1,1,Import,410,Rep. of Korea,KOR,392,Japan,JPN,,,,,,,,340311,"Lubricating preparations; for the treatment of textile and similar materials (leather, furskins etc), containing less than 70% (by weight) of petroleum oils or oils obtained from bituminous minerals",8,Weight in kilograms,2801460,,,,2801460,,9874951,,,0
H5,2020,2020,2020,6,1,1,Import,410,Rep. of Korea,KOR,392,Japan,JPN,,,,,,,,340319,"Lubricating preparations; (other than for the treatment of textile and similar materials), containing less than 70% (by weight) of petroleum oils or oils obtained from bituminous minerals",8,Weight in kilograms,537700,,,,537700,,3705864,,,0
H5,2020,2020,2020,6,1,1,Import,410,Rep. of Korea,KOR,392,Japan,JPN,,,,,,,,340391,"Lubricating preparations; for the treatment of textile and similar materials (leather, furskins etc), (not containing petroleum oils or oils obtained from bituminous minerals)",8,Weight in kilograms,2227123,,,,2227123,,8938952,,,0
H5,2020,2020,2020,6,1,1,Import,410,Rep. of Korea,KOR,392,Japan,JPN,,,,,,,,340399,"Lubricating preparations; other than for the treatment of textile and similar materials, not containing petroleum oils or oils obtained from bituminous minerals",8,Weight in kilograms,5500054,,,,5500054,,32180542,,,0
H5,2020,2020,2020,6,1,1,Import,410,Rep. of Korea,KOR,392,Japan,JPN,,,,,,,,340420,"Waxes; artificial and prepared, of poly(oxyethylene) (polyethylene glycol)",8,Weight in kilograms,169081,,,,169081,,702053,,,0
H5,2020,2020,2020,6,1,1,Import,410,Rep. of Korea,KOR,392,Japan,JPN,,,,,,,,340490,"Waxes; artificial and prepared, other than of polyethylene glycol",8,Weight in kilograms,1498416,,,,1498416,,6944023,,,0
H5,2020,2020,2020,6,1,1,Import,410,Rep. of Korea,KOR,392,Japan,JPN,,,,,,,,340510,"Polishes, creams and similar preparations; for footwear or leather, excluding waxes of heading no. 3404",8,Weight in kilograms,2534,,,,2534,,58555,,,0
H5,2020,2020,2020,6,1,1,Import,410,Rep. of Korea,KOR,392,Japan,JPN,,,,,,,,340520,"Polishes, creams and similar preparations; for the maintenance of wooden furniture, floors or other woodwork, excluding waxes of heading no. 3404",8,Weight in kilograms,5572,,,,5572,,49963,,,0
H5,2020,2020,2020,6,1,1,Import,410,Rep. of Korea,KOR,392,Japan,JPN,,,,,,,,340530,"Polishes, creams and similar preparations; for coachwork, other than metal polishes, excluding waxes of heading no. 3404",8,Weight in kilograms,54515,,,,54515,,902086,,,0
H5,2020,2020,2020,6,1,1,Import,410,Rep. of Korea,KOR,392,Japan,JPN,,,,,,,,340540,"Scouring pastes and powders and other scouring preparations; (whether or not in the form of paper, wadding, felt, nonwovens, cellular plastics, cellular rubber, impregnated, coated or covered)",8,Weight in kilograms,15967810,,,,15967810,,123657297,,,0
H5,2020,2020,2020,6,1,1,Import,410,Rep. of Korea,KOR,392,Japan,JPN,,,,,,,,340590,"Polishes, creams and similar preparations; n.e.c. in heading no. 3405, excluding waxes of heading no. 3404",8,Weight in kilograms,5697973,,,,5697973,,25593940,,,0
H5,2020,2020,2020,6,1,1,Import,410,Rep. of Korea,KOR,392,Japan,JPN,,,,,,,,340600,"Candles, tapers and the like",8,Weight in kilograms,747,,,,747,,27372,,,0
H5,2020,2020,2020,6,1,1,Import,410,Rep. of Korea,KOR,392,Japan,JPN,,,,,,,,340700,"Modelling pastes; preparations known as dental wax, put up in sets, in packings for retail sale or in plates, horseshoe shapes, sticks or similar forms, other preparations for use in dentistry",8,Weight in kilograms,282249,,,,282249,,3437327,,,0
H5,2020,2020,2020,6,1,1,Import,410,Rep. of Korea,KOR,392,Japan,JPN,,,,,,,,350190,Caseinates and other casein derivatives; casein glues,8,Weight in kilograms,1204,,,,1204,,24664,,,6
H5,2020,2020,2020,6,1,1,Import,410,Rep. of Korea,KOR,392,Japan,JPN,,,,,,,,350290,"Albumins, albuminates and other albumin derivatives; other than egg or milk albumin, including concentrates of two or more whey proteins",8,Weight in kilograms,11,,,,11,,309,,,0
H5,2020,2020,2020,6,1,1,Import,410,Rep. of Korea,KOR,392,Japan,JPN,,,,,,,,350300,"Gelatin (including gelatin in rectangular sheets, whether or not surface-worked or coloured) and gelatin derivatives; isinglass; other glues of animal origin, excluding casein glues of heading no. 3501",8,Weight in kilograms,211580,,,,211580,,86715,,,0
H5,2020,2020,2020,6,1,1,Import,410,Rep. of Korea,KOR,392,Japan,JPN,,,,,,,,350400,"Peptones and their derivatives; other protein substances and their derivatives n.e.c. or included, hide powder, whether or not chromed",8,Weight in kilograms,66544,,,,66544,,7333685,,,0
H5,2020,2020,2020,6,1,1,Import,410,Rep. of Korea,KOR,392,Japan,JPN,,,,,,,,350510,Dextrins and other modified starches,8,Weight in kilograms,289875,,,,289875,,1446233,,,0
H5,2020,2020,2020,6,1,1,Import,410,Rep. of Korea,KOR,392,Japan,JPN,,,,,,,,350520,"Glues; based on starches, or on dextrins or other modified starches",8,Weight in kilograms,28,,,,28,,119,,,0
H5,2020,2020,2020,6,1,1,Import,410,Rep. of Korea,KOR,392,Japan,JPN,,,,,,,,350610,"Glues or adhesives; prepared, products suitable for use as glues or adhesives, put up for retail sale as glues or adhesives, not exceeding a net weight of 1kg",8,Weight in kilograms,595033,,,,595033,,66518205,,,0
H5,2020,2020,2020,6,1,1,Import,410,Rep. of Korea,KOR,392,Japan,JPN,,,,,,,,350691,"Adhesives; prepared, based on polymers of heading 3901 to 3913 or on rubber",8,Weight in kilograms,4242850,,,,4242850,,89285524,,,0
H5,2020,2020,2020,6,1,1,Import,410,Rep. of Korea,KOR,392,Japan,JPN,,,,,,,,350699,"Glues and other adhesives; prepared, n.e.c. in heading no. 3506, not exceeding a net weight of 1kg",8,Weight in kilograms,1234632,,,,1234632,,20526797,,,0
H5,2020,2020,2020,6,1,1,Import,410,Rep. of Korea,KOR,392,Japan,JPN,,,,,,,,350710,Enzymes; rennet and concentrates thereof,8,Weight in kilograms,100,,,,100,,7192,,,0
H5,2020,2020,2020,6,1,1,Import,410,Rep. of Korea,KOR,392,Japan,JPN,,,,,,,,350790,Enzymes and prepared enzymes; other than rennet and concentrates thereof,8,Weight in kilograms,69157,,,,69157,,6882246,,,0
H5,2020,2020,2020,6,1,1,Import,410,Rep. of Korea,KOR,392,Japan,JPN,,,,,,,,360100,Explosives; propellent powders,8,Weight in kilograms,97049,,,,97049,,2817925,,,0
H5,2020,2020,2020,6,1,1,Import,410,Rep. of Korea,KOR,392,Japan,JPN,,,,,,,,360300,"Fuses and detonators; safety or detonating fuses, percussion or detonating caps, igniters, electric detonators",8,Weight in kilograms,2138,,,,2138,,844018,,,0
H5,2020,2020,2020,6,1,1,Import,410,Rep. of Korea,KOR,392,Japan,JPN,,,,,,,,360610,"Fuels; liquid or liquefied-gas, in containers, of a kind used for filling or refilling cigarette or similar lighters, (of a capacity not exceeding 300cm3)",8,Weight in kilograms,18,,,,18,,3155,,,6
H5,2020,2020,2020,6,1,1,Import,410,Rep. of Korea,KOR,392,Japan,JPN,,,,,,,,360690,Ferro-cerium and other pyrophoric alloys in all forms; articles of combustible materials n.e.c. in chapter 36,8,Weight in kilograms,117177,,,,117177,,326181,,,0
H5,2020,2020,2020,6,1,1,Import,410,Rep. of Korea,KOR,392,Japan,JPN,,,,,,,,370110,"Photographic plates and film; for x-ray, in the flat, sensitised, unexposed, of any material other than paper, paperboard or textiles",2,Area in square metres,33135,,,,110586,,2229007,,,0
H5,2020,2020,2020,6,1,1,Import,410,Rep. of Korea,KOR,392,Japan,JPN,,,,,,,,370120,"Photographic plates and film; instant print film, in the flat, sensitised, unexposed, whether or not in packs",8,Weight in kilograms,51725,,,,51725,,4204713,,,0
H5,2020,2020,2020,6,1,1,Import,410,Rep. of Korea,KOR,392,Japan,JPN,,,,,,,,370130,"Photographic plates and film; in the flat, sensitised, unexposed, with any side exceeding 225mm, of any materials other than paper, paperboard or textiles",2,Area in square metres,685708,,,,932512,,35876945,,,0
H5,2020,2020,2020,6,1,1,Import,410,Rep. of Korea,KOR,392,Japan,JPN,,,,,,,,370191,"Photographic plates and film; for colour photography (polychrome), in the flat, sensitised, unexposed, with no side exceeding 255mm, of any material other than paper, paperboard or textiles",8,Weight in kilograms,2548,,,,2548,,163359,,,0
H5,2020,2020,2020,6,1,1,Import,410,Rep. of Korea,KOR,392,Japan,JPN,,,,,,,,370199,"Photographic plates and film; (for other than colour photography), in the flat, sensitised, unexposed, with no side exceeding 255mm, of any material other than paper, paperboard or textiles",2,Area in square metres,65918,,,,39686,,38491831,,,0
H5,2020,2020,2020,6,1,1,Import,410,Rep. of Korea,KOR,392,Japan,JPN,,,,,,,,370210,"Photographic film; for x-rays, in rolls, sensitised and unexposed (other than of paper, paperboard or textiles)",2,Area in square metres,31680,,,,31119,,2278029,,,0
H5,2020,2020,2020,6,1,1,Import,410,Rep. of Korea,KOR,392,Japan,JPN,,,,,,,,370231,"Photographic film; for colour photography (polychrome), in rolls, sensitised, unexposed, without sprocket holes, of a width not exceeding 105mm (other than of paper, paperboard or textiles)",5,Number of items,651,,,,233,,19901,,,0
H5,2020,2020,2020,6,1,1,Import,410,Rep. of Korea,KOR,392,Japan,JPN,,,,,,,,370232,"Photographic film; in rolls, with silver halide emulsion, sensitised, unexposed, without sprocket holes, of a width not exceeding 105mm (other than of paper, paperboard or textiles)",2,Area in square metres,10159,,,,1238,,94817,,,0
H5,2020,2020,2020,6,1,1,Import,410,Rep. of Korea,KOR,392,Japan,JPN,,,,,,,,370239,"Photographic film; in rolls, (other than with silver halide emulsion and for colour photography), sensitised, unexposed, without sprocket holes, of a width not exceeding 105mm (other than of paper, paperboard or textiles)",2,Area in square metres,1282,,,,222,,30625,,,0
H5,2020,2020,2020,6,1,1,Import,410,Rep. of Korea,KOR,392,Japan,JPN,,,,,,,,370242,"Photographic film; in rolls, (other than for colour photography), sensitised, unexposed, without sprocket holes, of a width exceeding 610mm and of a length exceeding 200m (other than of paper, paperboard or textiles)",2,Area in square metres,10756270,,,,832398,,22917051,,,0
H5,2020,2020,2020,6,1,1,Import,410,Rep. of Korea,KOR,392,Japan,JPN,,,,,,,,370243,"Photographic film; in rolls, sensitised, unexposed, without sprocket holes, of a width exceeding 610mm and of a length not exceeding 200m (other than of paper, paperboard or textiles)",2,Area in square metres,12487,,,,1201,,74433,,,0
H5,2020,2020,2020,6,1,1,Import,410,Rep. of Korea,KOR,392,Japan,JPN,,,,,,,,370244,"Photographic film; in rolls, sensitised, unexposed, without sprocket holes, of a width exceeding 105mm but not exceeding 610mm (other than of paper, paperboard or textiles)",2,Area in square metres,3150367,,,,512524,,56802791,,,0
H5,2020,2020,2020,6,1,1,Import,410,Rep. of Korea,KOR,392,Japan,JPN,,,,,,,,370252,"Photographic film; for colour photography (polychrome), in rolls, sensitised, unexposed, of a width not exceeding 16mm (other than of paper, paperboard or textiles)",4,Length in metres,5,,,,8,,1915,,,0
H5,2020,2020,2020,6,1,1,Import,410,Rep. of Korea,KOR,392,Japan,JPN,,,,,,,,370253,"Photographic film; for colour photography (polychrome) slides, in rolls, sensitised, unexposed, of a width exceeding 16mm but not exceeding 35mm and of a length not exceeding 30m (other than of paper, paperboard or textiles)",4,Length in metres,370,,,,15,,6725,,,0
H5,2020,2020,2020,6,1,1,Import,410,Rep. of Korea,KOR,392,Japan,JPN,,,,,,,,370254,"Photographic film; for colour photography (polychrome), in rolls, sensitised, unexposed, of a width exceeding 16mm but not 35mm and of a length not exceeding 30m, excluding film for slides (other than of paper, paperboard or textiles)",4,Length in metres,102982,,,,3623,,330620,,,0
H5,2020,2020,2020,6,1,1,Import,410,Rep. of Korea,KOR,392,Japan,JPN,,,,,,,,370255,"Photographic film; for colour photography (polychrome), in rolls, sensitised, unexposed, of a width exceeding 16mm but not 35mm and of a length exceeding 30m (other than of paper, paperboard or textiles)",4,Length in metres,1820,,,,54,,12765,,,2
H5,2020,2020,2020,6,1,1,Import,410,Rep. of Korea,KOR,392,Japan,JPN,,,,,,,,370296,"Photographic film; other than for colour photography, in rolls, sensitised, unexposed, of a width not exceeding 35mm and of a length not exceeding 30m (other than of paper, paperboard or textiles)",4,Length in metres,1909,,,,382,,19440,,,0
H5,2020,2020,2020,6,1,1,Import,410,Rep. of Korea,KOR,392,Japan,JPN,,,,,,,,370297,"Photographic film; other than for colour photography, in rolls, sensitised, unexposed, of a width not exceeding 35mm and of a length exceeding 30m (other than paper, paperboard or textiles)",4,Length in metres,29131,,,,269,,20917,,,0
H5,2020,2020,2020,6,1,1,Import,410,Rep. of Korea,KOR,392,Japan,JPN,,,,,,,,370298,"Photographic film; other than for colour photography, in rolls, sensitised, unexposed, of a width exceeding 35mm (other than of paper, paperboard or textiles)",4,Length in metres,1004,,,,122,,12896,,,4
H5,2020,2020,2020,6,1,1,Import,410,Rep. of Korea,KOR,392,Japan,JPN,,,,,,,,370310,"Photographic paper, paperboard and textiles; in rolls, sensitised, unexposed, of a width exceeding 610mm",8,Weight in kilograms,9959,,,,9959,,328336,,,0
H5,2020,2020,2020,6,1,1,Import,410,Rep. of Korea,KOR,392,Japan,JPN,,,,,,,,370390,"Photographic paper, paperboard and textiles; (for other than colour photography, other than in rolls of a width exceeding 610mm), sensitised, unexposed",8,Weight in kilograms,2682,,,,2682,,111640,,,0
H5,2020,2020,2020,6,1,1,Import,410,Rep. of Korea,KOR,392,Japan,JPN,,,,,,,,370400,"Photographic plates, film, paper, paperboard and textiles; exposed but not developed",8,Weight in kilograms,125,,,,125,,630445,,,6
H5,2020,2020,2020,6,1,1,Import,410,Rep. of Korea,KOR,392,Japan,JPN,,,,,,,,370500,"Photographic plates and film; exposed and developed, other than cinematographic film",8,Weight in kilograms,34558,,,,34558,,100787440,,,0
H5,2020,2020,2020,6,1,1,Import,410,Rep. of Korea,KOR,392,Japan,JPN,,,,,,,,370610,"Cinematographic film; exposed and developed, whether or not incorporating sound track or consisting only of sound track, of a width of 35cm or more",4,Length in metres,2,,,,1,,273,,,0
H5,2020,2020,2020,6,1,1,Import,410,Rep. of Korea,KOR,392,Japan,JPN,,,,,,,,370690,"Cinematographic film; exposed and developed, whether or not incorporating a sound track or consisting only of sound track, of a width less than 35mm",4,Length in metres,1,,,,2,,35,,,0
H5,2020,2020,2020,6,1,1,Import,410,Rep. of Korea,KOR,392,Japan,JPN,,,,,,,,370710,"Photographic goods; sensitised emulsions, put up in measured portions or put up for retail sale in a form ready for use",8,Weight in kilograms,57230,,,,57230,,1800834,,,0
H5,2020,2020,2020,6,1,1,Import,410,Rep. of Korea,KOR,392,Japan,JPN,,,,,,,,370790,"Photographic goods; chemical preparations other than sensitised emulsions, put up in measured portions or put up for retail sale in a form ready for use",8,Weight in kilograms,2745982,,,,2745982,,436949918,,,0
H5,2020,2020,2020,6,1,1,Import,410,Rep. of Korea,KOR,392,Japan,JPN,,,,,,,,380110,Graphite; artificial,8,Weight in kilograms,3615672,,,,3615672,,28678607,,,0
H5,2020,2020,2020,6,1,1,Import,410,Rep. of Korea,KOR,392,Japan,JPN,,,,,,,,380120,Graphite; colloidal or semi-colloidal,8,Weight in kilograms,30280,,,,30280,,329921,,,0
H5,2020,2020,2020,6,1,1,Import,410,Rep. of Korea,KOR,392,Japan,JPN,,,,,,,,380130,Carbonaceous pastes; for electrodes and similar pastes for furnace linings,8,Weight in kilograms,173858,,,,173858,,472999,,,0
H5,2020,2020,2020,6,1,1,Import,410,Rep. of Korea,KOR,392,Japan,JPN,,,,,,,,380190,"Graphite or other carbon based preparations; in the form of pastes, blocks, plates or other semi-manufactures",8,Weight in kilograms,554930,,,,554930,,5645526,,,0
H5,2020,2020,2020,6,1,1,Import,410,Rep. of Korea,KOR,392,Japan,JPN,,,,,,,,380210,Carbon; activated,8,Weight in kilograms,2319901,,,,2319901,,17224908,,,0
H5,2020,2020,2020,6,1,1,Import,410,Rep. of Korea,KOR,392,Japan,JPN,,,,,,,,380290,"Chemical products; activated natural mineral products, animal black, including spent animal black",8,Weight in kilograms,200020,,,,200020,,5800102,,,0
H5,2020,2020,2020,6,1,1,Import,410,Rep. of Korea,KOR,392,Japan,JPN,,,,,,,,380300,"Chemical products; tall oil, whether or not refined",8,Weight in kilograms,20,,,,20,,180,,,0
H5,2020,2020,2020,6,1,1,Import,410,Rep. of Korea,KOR,392,Japan,JPN,,,,,,,,380400,"Lyes, residual; from the manufacture of wood pulp, whether or not concentrated, desugared or chemically treated, including lignin sulphonates but excluding tall oil of heading no. 3803",8,Weight in kilograms,66142,,,,66142,,265803,,,6
H5,2020,2020,2020,6,1,1,Import,410,Rep. of Korea,KOR,392,Japan,JPN,,,,,,,,380590,"Terpenic oils; produced by the treatment of coniferous woods, crude dipentene, sulphite turpentine and other crude para-cymene, n.e.c. in heading no. 3805",8,Weight in kilograms,175,,,,175,,3484,,,0
H5,2020,2020,2020,6,1,1,Import,410,Rep. of Korea,KOR,392,Japan,JPN,,,,,,,,380610,Rosin and resin acids,8,Weight in kilograms,15361,,,,15361,,262488,,,0
H5,2020,2020,2020,6,1,1,Import,410,Rep. of Korea,KOR,392,Japan,JPN,,,,,,,,380620,"Rosin and resin; salts of rosin, of resin acids or of derivatives of rosin or resin acids, other than salts of rosin adducts",8,Weight in kilograms,1,,,,1,,22,,,0
H5,2020,2020,2020,6,1,1,Import,410,Rep. of Korea,KOR,392,Japan,JPN,,,,,,,,380630,Ester gums,8,Weight in kilograms,41798,,,,41798,,302437,,,0
H5,2020,2020,2020,6,1,1,Import,410,Rep. of Korea,KOR,392,Japan,JPN,,,,,,,,380690,"Rosin; spirit and oils, n.e.c. in heading no. 3806",8,Weight in kilograms,120061,,,,120061,,975015,,,0
H5,2020,2020,2020,6,1,1,Import,410,Rep. of Korea,KOR,392,Japan,JPN,,,,,,,,380700,"Wood tar; wood tar oils; wood creosote; wood naphtha; vegetable pitch; brewers' pitch and similar preparations based on rosin, resin acids or on vegetable pitch",8,Weight in kilograms,7948,,,,7948,,33190,,,0
H5,2020,2020,2020,6,1,1,Import,410,Rep. of Korea,KOR,392,Japan,JPN,,,,,,,,380891,Insecticides; other than containing goods specified in Subheading Notes 1 & 2 to this Chapter; put up in forms or packings for retail sale or as preparations or articles,8,Weight in kilograms,180760,,,,180760,,8844112,,,0
H5,2020,2020,2020,6,1,1,Import,410,Rep. of Korea,KOR,392,Japan,JPN,,,,,,,,380892,Fungicides; other than containing goods specified in Subheading Note 1 to this Chapter; put up in forms or packings for retail sale or as preparations or articles,8,Weight in kilograms,585192,,,,585192,,10879805,,,0
H5,2020,2020,2020,6,1,1,Import,410,Rep. of Korea,KOR,392,Japan,JPN,,,,,,,,380893,"Herbicides, anti-sprouting products and plant-growth regulators; other than containing goods of Subheading Note 1 to this Chapter; put up in forms or packings for retail sale or as preparations or articles",8,Weight in kilograms,78059,,,,78059,,2385811,,,0
H5,2020,2020,2020,6,1,1,Import,410,Rep. of Korea,KOR,392,Japan,JPN,,,,,,,,380894,Disinfectants; other than containing goods specified in Subheading Note 1 in this Chapter; put up in forms or packings for retail sale or as preparations or articles,8,Weight in kilograms,459289,,,,459289,,3690848,,,0
H5,2020,2020,2020,6,1,1,Import,410,Rep. of Korea,KOR,392,Japan,JPN,,,,,,,,380899,"Rodenticides and other similar products n.e.c. in heading no. 3808.9; other than containing goods specified in Subheading Note 1 in this Chapter, put up in forms or packings for retail sale or as preparations or articles",8,Weight in kilograms,96789,,,,96789,,3038715,,,0
H5,2020,2020,2020,6,1,1,Import,410,Rep. of Korea,KOR,392,Japan,JPN,,,,,,,,380910,"Finishing agents and dye carriers; to accelerate dyeing or fixing of dye-stuffs, other products and preparations, used in textile, paper, leather etc industries, with basis of amylaceous substances, n.e.c.",8,Weight in kilograms,37762,,,,37762,,176790,,,0
H5,2020,2020,2020,6,1,1,Import,410,Rep. of Korea,KOR,392,Japan,JPN,,,,,,,,380991,"Finishing agents and dye carriers; to accelerate dyeing or fixing of dye-stuffs, other products and preparations, used in the textile industry (excluding those with a basis of amylaceous substances)",8,Weight in kilograms,828260,,,,828260,,4352022,,,0
H5,2020,2020,2020,6,1,1,Import,410,Rep. of Korea,KOR,392,Japan,JPN,,,,,,,,380992,"Finishing agents and dye carriers; to accelerate dyeing or fixing of dye-stuffs, other products and preparations, used in the paper industry (excluding those with a basis of amylaceous substances)",8,Weight in kilograms,406584,,,,406584,,1238606,,,0
H5,2020,2020,2020,6,1,1,Import,410,Rep. of Korea,KOR,392,Japan,JPN,,,,,,,,380993,"Finishing agents and dye carriers; to accelerate dyeing or fixing of dye-stuffs, other products and preparations, used in the leather or like (excluding paper and textile) industries, (excluding those with a basis of amylaceous substances)",8,Weight in kilograms,20314,,,,20314,,152928,,,0
H5,2020,2020,2020,6,1,1,Import,410,Rep. of Korea,KOR,392,Japan,JPN,,,,,,,,381010,"Pickling preparations for metal surfaces; soldering, brazing or welding powders and pastes consisting of metal and other materials",8,Weight in kilograms,2020516,,,,2020516,,31061354,,,0
H5,2020,2020,2020,6,1,1,Import,410,Rep. of Korea,KOR,392,Japan,JPN,,,,,,,,381090,"Fluxes and other auxiliary preparations; for soldering, brazing or welding, or preparations used as cores or coatings for welding electrodes or rods",8,Weight in kilograms,1003747,,,,1003747,,18803018,,,0
H5,2020,2020,2020,6,1,1,Import,410,Rep. of Korea,KOR,392,Japan,JPN,,,,,,,,381119,Anti-knock preparations; other than those based on lead compounds,8,Weight in kilograms,48320,,,,48320,,519853,,,0
