H5,2020,2020,2020,6,1,1,Import,410,Rep. of Korea,KOR,392,Japan,JPN,,,,,,,,580122,"Fabrics; woven pile, of cotton, cut corduroy, other than fabrics of heading no. 5802 or 5806",8,Weight in kilograms,1189,,,,1189,,43266,,,0
H5,2020,2020,2020,6,1,1,Import,410,Rep. of Korea,KOR,392,Japan,JPN,,,,,,,,580123,"Fabrics; woven pile, of cotton, weft pile fabrics other than uncut and corduroy, other than fabrics of heading no. 5802 or 5806",8,Weight in kilograms,3839,,,,3839,,129252,,,0
H5,2020,2020,2020,6,1,1,Import,410,Rep. of Korea,KOR,392,Japan,JPN,,,,,,,,580126,"Fabrics; chenille, of cotton, other than fabrics of heading no. 5802 or 5806",8,Weight in kilograms,313,,,,313,,19167,,,0
H5,2020,2020,2020,6,1,1,Import,410,Rep. of Korea,KOR,392,Japan,JPN,,,,,,,,580127,"Fabrics; woven pile, of cotton, warp pile fabrics, other than fabrics of heading no. 5802 or 5806",8,Weight in kilograms,144,,,,144,,7715,,,0
H5,2020,2020,2020,6,1,1,Import,410,Rep. of Korea,KOR,392,Japan,JPN,,,,,,,,580131,"Fabrics; woven pile, of man-made fibres, uncut weft pile fabrics, other than fabrics of heading no. 5802 or 5806",8,Weight in kilograms,275,,,,275,,10965,,,0
H5,2020,2020,2020,6,1,1,Import,410,Rep. of Korea,KOR,392,Japan,JPN,,,,,,,,580132,"Fabrics; woven pile, of man-made fibres, cut corduroy, other than fabrics of heading no. 5802 or 5806",8,Weight in kilograms,1200,,,,1200,,40419,,,0
H5,2020,2020,2020,6,1,1,Import,410,Rep. of Korea,KOR,392,Japan,JPN,,,,,,,,580133,"Fabrics; woven pile, of man-made fibres, other weft pile fabrics, other than fabrics of heading no. 5802 or 5806",8,Weight in kilograms,188,,,,188,,7261,,,6
H5,2020,2020,2020,6,1,1,Import,410,Rep. of Korea,KOR,392,Japan,JPN,,,,,,,,580136,"Fabrics; chenille, of man-made fibres, other than fabrics of heading no. 5802 or 5806",8,Weight in kilograms,485,,,,485,,31036,,,0
H5,2020,2020,2020,6,1,1,Import,410,Rep. of Korea,KOR,392,Japan,JPN,,,,,,,,580137,"Fabrics; woven pile, of man-made fibres, warp pile fabrics, other than fabrics of heading no. 5802 or 5806",8,Weight in kilograms,35812,,,,35812,,1974836,,,0
H5,2020,2020,2020,6,1,1,Import,410,Rep. of Korea,KOR,392,Japan,JPN,,,,,,,,580190,"Fabrics; woven pile and chenille, of textile materials n.e.c. in heading no. 5801, other than fabrics of heading no. 5802 or 5806",8,Weight in kilograms,64,,,,64,,4050,,,0
H5,2020,2020,2020,6,1,1,Import,410,Rep. of Korea,KOR,392,Japan,JPN,,,,,,,,580219,"Fabrics; terry towelling and similar woven terry fabrics, of cotton, bleached, excluding narrow fabrics of heading no. 5806",8,Weight in kilograms,63,,,,63,,4817,,,6
H5,2020,2020,2020,6,1,1,Import,410,Rep. of Korea,KOR,392,Japan,JPN,,,,,,,,580220,"Fabrics; terry towelling and similar woven terry fabrics, of textile materials, excluding cotton, excluding narrow fabrics of heading no. 5806",8,Weight in kilograms,42,,,,42,,3728,,,6
H5,2020,2020,2020,6,1,1,Import,410,Rep. of Korea,KOR,392,Japan,JPN,,,,,,,,580300,Gauze; other than narrow fabrics of heading no. 5806,8,Weight in kilograms,816,,,,816,,38988,,,0
H5,2020,2020,2020,6,1,1,Import,410,Rep. of Korea,KOR,392,Japan,JPN,,,,,,,,580410,"Tulles and other net fabrics; excluding woven, knitted or crocheted fabrics, (other than fabrics of headings 60.02 to 60.06)",8,Weight in kilograms,468,,,,468,,40046,,,6
H5,2020,2020,2020,6,1,1,Import,410,Rep. of Korea,KOR,392,Japan,JPN,,,,,,,,580421,"Lace; mechanically made, of man-made fibres in the piece, in strips or in motifs, (other than fabrics of headings 60.02 to 60.06)",8,Weight in kilograms,1852,,,,1852,,148656,,,0
H5,2020,2020,2020,6,1,1,Import,410,Rep. of Korea,KOR,392,Japan,JPN,,,,,,,,580429,"Lace; mechanically made, of textile materials, (other than man-made fibres), in the piece, in strips or motifs, (other than fabrics of headings 60.02 to 60.06)",8,Weight in kilograms,1540,,,,1540,,160080,,,0
H5,2020,2020,2020,6,1,1,Import,410,Rep. of Korea,KOR,392,Japan,JPN,,,,,,,,580500,"Tapestries; hand-woven, (Gobelins, Flanders, Aubusson, Beauvais and the like) and needle-worked tapestries (e.g. petit point, cross-stitch) whether or not made up",8,Weight in kilograms,225,,,,225,,24812,,,0
H5,2020,2020,2020,6,1,1,Import,410,Rep. of Korea,KOR,392,Japan,JPN,,,,,,,,580610,Fabrics; woven pile (including terry towelling and similar terry fabrics) and chenille fabrics (excluding goods of heading no. 5807),8,Weight in kilograms,6589,,,,6589,,532281,,,0
H5,2020,2020,2020,6,1,1,Import,410,Rep. of Korea,KOR,392,Japan,JPN,,,,,,,,580620,"Fabrics; narrow (excluding pile fabrics), containing by weight 5% or more of elastomeric yarn or rubber thread",8,Weight in kilograms,1039,,,,1039,,31175,,,6
H5,2020,2020,2020,6,1,1,Import,410,Rep. of Korea,KOR,392,Japan,JPN,,,,,,,,580631,"Fabrics; narrow woven fabrics, n.e.c. in heading no. 5806, of cotton (excluding goods of heading no. 5807)",8,Weight in kilograms,153,,,,153,,9166,,,0
H5,2020,2020,2020,6,1,1,Import,410,Rep. of Korea,KOR,392,Japan,JPN,,,,,,,,580632,"Fabrics, narrow woven fabrics, n.e.c. in heading no. 5806, of man-made fibres (excluding goods of heading no. 5807)",8,Weight in kilograms,98754,,,,98754,,1423802,,,0
H5,2020,2020,2020,6,1,1,Import,410,Rep. of Korea,KOR,392,Japan,JPN,,,,,,,,580639,"Fabrics; narrow woven fabrics, n.e.c. in heading no. 5806, of textile materials n.e.c. in item no. 5806.3 (excluding goods of heading no. 5807)",8,Weight in kilograms,1519,,,,1519,,46957,,,0
H5,2020,2020,2020,6,1,1,Import,410,Rep. of Korea,KOR,392,Japan,JPN,,,,,,,,580640,"Fabrics; narrow woven, consisting of warp without weft, assembled by means of an adhesive (bolducs)",8,Weight in kilograms,2,,,,2,,10,,,6
H5,2020,2020,2020,6,1,1,Import,410,Rep. of Korea,KOR,392,Japan,JPN,,,,,,,,580710,"Labels, badges and similar articles; woven, of textile materials, in the piece, in strips or cut to shape or size, not embroidered",8,Weight in kilograms,1528,,,,1528,,198192,,,0
H5,2020,2020,2020,6,1,1,Import,410,Rep. of Korea,KOR,392,Japan,JPN,,,,,,,,580790,"Labels, badges and similar articles; (other than woven), of textile materials, in the piece, in strips or cut to shape or size, not embroidered",8,Weight in kilograms,955,,,,955,,152435,,,0
H5,2020,2020,2020,6,1,1,Import,410,Rep. of Korea,KOR,392,Japan,JPN,,,,,,,,580810,Braids; in the piece,8,Weight in kilograms,20420,,,,20420,,1980070,,,0
H5,2020,2020,2020,6,1,1,Import,410,Rep. of Korea,KOR,392,Japan,JPN,,,,,,,,580890,"Ornamental trimmings; tassels, pompons and similar articles; ornamental trimmings in the piece, without embroidery, other than knitted or crocheted",8,Weight in kilograms,1407,,,,1407,,29017,,,0
H5,2020,2020,2020,6,1,1,Import,410,Rep. of Korea,KOR,392,Japan,JPN,,,,,,,,580900,"Fabrics, woven; of metal thread and metallised yarn of heading no. 5605, of a kind used in apparel, as furnishing fabrics or similar purposes; n.e.c. or included",8,Weight in kilograms,44,,,,44,,10455,,,0
H5,2020,2020,2020,6,1,1,Import,410,Rep. of Korea,KOR,392,Japan,JPN,,,,,,,,581010,"Embroidery; without visible ground, in the piece, in strips or in motifs",8,Weight in kilograms,1775,,,,1775,,12244,,,0
H5,2020,2020,2020,6,1,1,Import,410,Rep. of Korea,KOR,392,Japan,JPN,,,,,,,,581091,"Embroidery; with visible ground, of cotton, in the piece, in strips or in motifs",8,Weight in kilograms,64,,,,64,,9214,,,0
H5,2020,2020,2020,6,1,1,Import,410,Rep. of Korea,KOR,392,Japan,JPN,,,,,,,,581092,"Embroidery; with visible ground, of man-made fibres, in the piece, in strips or in motifs",8,Weight in kilograms,152,,,,152,,21773,,,0
H5,2020,2020,2020,6,1,1,Import,410,Rep. of Korea,KOR,392,Japan,JPN,,,,,,,,581099,"Embroidery; with visible ground, of textile materials (other than cotton and man-made fibres), in the piece, in strips or in motifs",8,Weight in kilograms,101,,,,101,,3157,,,6
H5,2020,2020,2020,6,1,1,Import,410,Rep. of Korea,KOR,392,Japan,JPN,,,,,,,,581100,"Quilted textile products; in the piece, composed of one or more layers of textile materials assembled with padding by stitching or otherwise (excluding embroidery of heading no. 5810)",8,Weight in kilograms,3285,,,,3285,,110286,,,0
H5,2020,2020,2020,6,1,1,Import,410,Rep. of Korea,KOR,392,Japan,JPN,,,,,,,,590190,"Textile fabrics; coated with gum or amylaceous substances, tracing cloth, prepared painting canvas, buckram and similar stiffened textile fabrics for hat foundations, (excluding book covers)",8,Weight in kilograms,206,,,,206,,1306,,,6
H5,2020,2020,2020,6,1,1,Import,410,Rep. of Korea,KOR,392,Japan,JPN,,,,,,,,590210,Textile fabrics; tyrecord of high tenacity yarn of nylon or other polyamides,8,Weight in kilograms,126,,,,126,,4874,,,0
H5,2020,2020,2020,6,1,1,Import,410,Rep. of Korea,KOR,392,Japan,JPN,,,,,,,,590220,Textile fabrics; tyrecord of high tenacity yarn of polyester,8,Weight in kilograms,5,,,,5,,14,,,6
H5,2020,2020,2020,6,1,1,Import,410,Rep. of Korea,KOR,392,Japan,JPN,,,,,,,,590310,"Textile fabrics; impregnated, coated, covered or laminated with poly(vinyl chloride)",8,Weight in kilograms,3537,,,,3537,,96921,,,0
H5,2020,2020,2020,6,1,1,Import,410,Rep. of Korea,KOR,392,Japan,JPN,,,,,,,,590320,"Textile fabrics; impregnated, coated, covered or laminated with polyurethane",8,Weight in kilograms,64316,,,,64316,,4685709,,,0
H5,2020,2020,2020,6,1,1,Import,410,Rep. of Korea,KOR,392,Japan,JPN,,,,,,,,590390,"Textile fabrics; impregnated, coated, covered or laminated with plastics, (excluding polyvinyl chloride, polyurethane and those of heading no. 5902)",8,Weight in kilograms,18304,,,,18304,,910345,,,0
H5,2020,2020,2020,6,1,1,Import,410,Rep. of Korea,KOR,392,Japan,JPN,,,,,,,,590410,"Linoleum, whether or not cut to shape",2,Area in square metres,40,,,,1200,,1254,,,0
H5,2020,2020,2020,6,1,1,Import,410,Rep. of Korea,KOR,392,Japan,JPN,,,,,,,,590500,"Textile wall coverings of fabrics impregnated, coated, covered or laminated",2,Area in square metres,327,,,,163,,41411,,,0
H5,2020,2020,2020,6,1,1,Import,410,Rep. of Korea,KOR,392,Japan,JPN,,,,,,,,590610,"Textile fabrics, rubberised; (excluding those of heading no. 5902), adhesive tape of a width not exceeding 20cm",8,Weight in kilograms,4859,,,,4859,,96316,,,0
H5,2020,2020,2020,6,1,1,Import,410,Rep. of Korea,KOR,392,Japan,JPN,,,,,,,,590699,"Textile fabrics, rubberised; (excluding those of heading no. 5902 and adhesive tape of a width not exceeding 20cm), not knitted or crocheted",8,Weight in kilograms,23046,,,,23046,,624615,,,0
H5,2020,2020,2020,6,1,1,Import,410,Rep. of Korea,KOR,392,Japan,JPN,,,,,,,,590700,"Textile fabrics; otherwise impregnated, coated or covered, painted canvas being theatrical scenery, studio back-cloths or the like",8,Weight in kilograms,10628,,,,10628,,118070,,,0
H5,2020,2020,2020,6,1,1,Import,410,Rep. of Korea,KOR,392,Japan,JPN,,,,,,,,590800,"Textile wicks, woven, plaited or knitted; for lamps, stoves, lighters, candles or the like; incandescent gas mantles and tubular knitted gas mantle fabric therefor, whether or not impregnated",8,Weight in kilograms,2293,,,,2293,,80383,,,6
H5,2020,2020,2020,6,1,1,Import,410,Rep. of Korea,KOR,392,Japan,JPN,,,,,,,,590900,"Textile hosepiping and similar textile tubing; with or without lining, armour or accessories of other materials",8,Weight in kilograms,72,,,,72,,2070,,,6
H5,2020,2020,2020,6,1,1,Import,410,Rep. of Korea,KOR,392,Japan,JPN,,,,,,,,591000,"Textiles; transmission or conveyor belts or belting, of textile material, whether or not impregnated, coated, covered or laminated with plastics, or reinforced with metal or other material",8,Weight in kilograms,72810,,,,72810,,4703970,,,0
H5,2020,2020,2020,6,1,1,Import,410,Rep. of Korea,KOR,392,Japan,JPN,,,,,,,,591110,"Textile fabric, felt & felt-lined woven fabrics, coated/covered/laminated with rubber, leather or other material, for card clothing, similar fabrics used for technical purposes, including rubber impregnated narrow velvet fabrics to cover weaving spindles",8,Weight in kilograms,616,,,,616,,216537,,,0
H5,2020,2020,2020,6,1,1,Import,410,Rep. of Korea,KOR,392,Japan,JPN,,,,,,,,591120,"Textile products and articles for technical uses; bolting cloth, whether or not made up",8,Weight in kilograms,51433,,,,51433,,2659024,,,0
H5,2020,2020,2020,6,1,1,Import,410,Rep. of Korea,KOR,392,Japan,JPN,,,,,,,,591131,"Textiles; fabrics and felts, endless or fitted with linking devices, of a kind used in paper-making or similar machines, weighing less than 650g/m2",8,Weight in kilograms,376,,,,376,,203330,,,0
H5,2020,2020,2020,6,1,1,Import,410,Rep. of Korea,KOR,392,Japan,JPN,,,,,,,,591132,"Textiles; fabrics and felts, endless or fitted with linking devices, of a kind used in paper-making or similar machines, weighing 650g/m2 or more",8,Weight in kilograms,56760,,,,56760,,3185991,,,0
H5,2020,2020,2020,6,1,1,Import,410,Rep. of Korea,KOR,392,Japan,JPN,,,,,,,,591140,"Textile products and articles for technical uses; straining cloth of a kind used in oil presses and the like, including that of human hair",8,Weight in kilograms,828,,,,828,,93275,,,6
H5,2020,2020,2020,6,1,1,Import,410,Rep. of Korea,KOR,392,Japan,JPN,,,,,,,,591190,Textile products and articles for technical uses; n.e.c. in heading no. 5911,8,Weight in kilograms,194120,,,,194120,,14789494,,,0
H5,2020,2020,2020,6,1,1,Import,410,Rep. of Korea,KOR,392,Japan,JPN,,,,,,,,600110,"Fabrics; long pile fabrics, knitted or crocheted",8,Weight in kilograms,1103,,,,1103,,22129,,,0
H5,2020,2020,2020,6,1,1,Import,410,Rep. of Korea,KOR,392,Japan,JPN,,,,,,,,600121,"Fabrics; looped pile fabrics, of cotton, knitted or crocheted",8,Weight in kilograms,58,,,,58,,2787,,,0
H5,2020,2020,2020,6,1,1,Import,410,Rep. of Korea,KOR,392,Japan,JPN,,,,,,,,600122,"Fabrics; looped pile fabrics, of man-made fibres, knitted or crocheted",8,Weight in kilograms,270,,,,270,,6050,,,0
H5,2020,2020,2020,6,1,1,Import,410,Rep. of Korea,KOR,392,Japan,JPN,,,,,,,,600129,"Fabrics; looped pile fabrics, of textile materials (other than cotton or man-made fibres), knitted or crocheted",8,Weight in kilograms,102,,,,102,,4888,,,0
H5,2020,2020,2020,6,1,1,Import,410,Rep. of Korea,KOR,392,Japan,JPN,,,,,,,,600191,"Fabrics; pile fabrics (excluding long pile and loop pile), of cotton, knitted or crocheted",8,Weight in kilograms,621,,,,621,,23712,,,0
H5,2020,2020,2020,6,1,1,Import,410,Rep. of Korea,KOR,392,Japan,JPN,,,,,,,,600192,"Fabrics; pile fabrics (excluding long pile and loop pile), of man-made fibres, knitted or crocheted",8,Weight in kilograms,925,,,,925,,32593,,,0
H5,2020,2020,2020,6,1,1,Import,410,Rep. of Korea,KOR,392,Japan,JPN,,,,,,,,600240,"Fabrics; knitted or crocheted, other than those of heading 60.01, of a width not exceeding 30 cm, containing by weight 5% or more of elastomeric yarn but not containing rubber thread",8,Weight in kilograms,813,,,,813,,35586,,,0
H5,2020,2020,2020,6,1,1,Import,410,Rep. of Korea,KOR,392,Japan,JPN,,,,,,,,600290,"Fabrics; knitted or crocheted, other than those of heading 60.01, of a width not exceeding 30 cm, containing by weight 5% or more of elastomeric yarn or rubber thread",8,Weight in kilograms,627,,,,627,,26378,,,0
H5,2020,2020,2020,6,1,1,Import,410,Rep. of Korea,KOR,392,Japan,JPN,,,,,,,,600330,"Fabrics; knitted or crocheted fabrics, other than those of heading 60.01 and 60.02, of a width not exceeding 30 cm, of synthetic fibres",8,Weight in kilograms,1462,,,,1462,,46430,,,0
H5,2020,2020,2020,6,1,1,Import,410,Rep. of Korea,KOR,392,Japan,JPN,,,,,,,,600410,"Fabrics; knitted or crocheted fabrics of a width exceeding 30 cm, other than those of heading 60.01, containing by weight 5% or more of elastomeric yarn but not containing rubber thread",8,Weight in kilograms,53133,,,,53133,,2028338,,,0
H5,2020,2020,2020,6,1,1,Import,410,Rep. of Korea,KOR,392,Japan,JPN,,,,,,,,600490,"Fabrics; knitted or crocheted, other than those of heading 60.01, of a width exceeding 30 cm, containing by weight 5% or more of elastomeric yarn or rubber thread,",8,Weight in kilograms,10356,,,,10356,,758656,,,0
H5,2020,2020,2020,6,1,1,Import,410,Rep. of Korea,KOR,392,Japan,JPN,,,,,,,,600522,"Fabrics; warp knit (including those made on galloon knitting machines), other than those of headings 60.01 to 60.04, of cotton, dyed",8,Weight in kilograms,844,,,,844,,35637,,,0
H5,2020,2020,2020,6,1,1,Import,410,Rep. of Korea,KOR,392,Japan,JPN,,,,,,,,600535,"Fabrics; warp knit (including those made on galloon knitting machines), other than those of headings 60.01 to 60.04, of synthetic fibres specified in Subheading Note 1 to this Chapter",8,Weight in kilograms,11517,,,,11517,,338200,,,0
H5,2020,2020,2020,6,1,1,Import,410,Rep. of Korea,KOR,392,Japan,JPN,,,,,,,,600536,"Fabrics; warp knit (including those made on galloon knitting machines), other than those of headings 60.01 to 60.04, of synthetic fibres, bleached or unbleached",8,Weight in kilograms,22784,,,,22784,,401333,,,0
H5,2020,2020,2020,6,1,1,Import,410,Rep. of Korea,KOR,392,Japan,JPN,,,,,,,,600537,"Fabrics; warp knit (including those made on galloon knitting machines), other than those of headings 60.01 to 60.04, of synthetic fibres, dyed",8,Weight in kilograms,16279,,,,16279,,417698,,,0
H5,2020,2020,2020,6,1,1,Import,410,Rep. of Korea,KOR,392,Japan,JPN,,,,,,,,600538,"Fabrics; warp knit (including those made on galloon knitting machines), other than those of headings 60.01 to 60.04, of synthetic fibres, yarns of different colours",8,Weight in kilograms,507,,,,507,,29051,,,0
H5,2020,2020,2020,6,1,1,Import,410,Rep. of Korea,KOR,392,Japan,JPN,,,,,,,,600539,"Fabrics; warp knit (including those made on galloon knitting machines), other than those of headings 60.01 to 60.04, of synthetic fibres, printed",8,Weight in kilograms,90,,,,90,,7181,,,0
H5,2020,2020,2020,6,1,1,Import,410,Rep. of Korea,KOR,392,Japan,JPN,,,,,,,,600542,"Fabrics; warp knit (including those made on galloon knitting machines), other than those of headings 60.01 to 60.04, of artificial fibres, dyed",8,Weight in kilograms,494,,,,494,,24697,,,0
H5,2020,2020,2020,6,1,1,Import,410,Rep. of Korea,KOR,392,Japan,JPN,,,,,,,,600544,"Fabrics; warp knit (including those made on galloon knitting machines), other than those of headings 60.01 to 60.04, of artificial fibres, printed",8,Weight in kilograms,29,,,,29,,714,,,0
H5,2020,2020,2020,6,1,1,Import,410,Rep. of Korea,KOR,392,Japan,JPN,,,,,,,,600590,"Fabrics; warp knit (including those made on galloon knitting machines), other than those of headings 60.01 to 60.04, excluding those made from cotton or synthetic or artificial fibres",8,Weight in kilograms,362,,,,362,,18969,,,0
H5,2020,2020,2020,6,1,1,Import,410,Rep. of Korea,KOR,392,Japan,JPN,,,,,,,,600610,"Fabrics; knitted or crocheted fabrics, other than those of headings 60.01 to 60.04, of wool or fine animal hair",8,Weight in kilograms,11331,,,,11331,,549135,,,0
H5,2020,2020,2020,6,1,1,Import,410,Rep. of Korea,KOR,392,Japan,JPN,,,,,,,,600621,"Fabrics; knitted or crocheted fabrics, other than those of headings 60.01 to 60.04, of cotton, unbleached or bleached",8,Weight in kilograms,438,,,,438,,20300,,,0
H5,2020,2020,2020,6,1,1,Import,410,Rep. of Korea,KOR,392,Japan,JPN,,,,,,,,600622,"Fabrics; knitted or crocheted fabrics, other than those of headings 60.01 to 60.04, of cotton, dyed",8,Weight in kilograms,57528,,,,57528,,2267469,,,0
H5,2020,2020,2020,6,1,1,Import,410,Rep. of Korea,KOR,392,Japan,JPN,,,,,,,,600623,"Fabrics; knitted or crocheted fabrics, other than those of headings 60.01 to 60.04, of cotton, of yarns of different colours",8,Weight in kilograms,739,,,,739,,25309,,,0
H5,2020,2020,2020,6,1,1,Import,410,Rep. of Korea,KOR,392,Japan,JPN,,,,,,,,600624,"Fabrics; knitted or crocheted fabrics, other than those of headings 60.01 to 60.04, of cotton, printed",8,Weight in kilograms,62,,,,62,,2275,,,6
H5,2020,2020,2020,6,1,1,Import,410,Rep. of Korea,KOR,392,Japan,JPN,,,,,,,,600631,"Fabrics; knitted or crocheted fabrics, other than those of headings 60.01 to 60.04, of synthetic fibres, unbleached or bleached",8,Weight in kilograms,31292,,,,31292,,930998,,,0
H5,2020,2020,2020,6,1,1,Import,410,Rep. of Korea,KOR,392,Japan,JPN,,,,,,,,600632,"Fabrics; knitted or crocheted fabrics, other than those of headings 60.01 to 60.04, of synthetic fibres, dyed",8,Weight in kilograms,83456,,,,83456,,2553627,,,0
H5,2020,2020,2020,6,1,1,Import,410,Rep. of Korea,KOR,392,Japan,JPN,,,,,,,,600633,"Fabrics; knitted or crocheted fabrics, other than those of headings 60.01 to 60.04, of synthetic fibres, of yarns of different colours",8,Weight in kilograms,2040,,,,2040,,84743,,,0
H5,2020,2020,2020,6,1,1,Import,410,Rep. of Korea,KOR,392,Japan,JPN,,,,,,,,600634,"Fabrics; knitted or crocheted fabrics, other than those of headings 60.01 to 60.04, of synthetic fibres, printed",8,Weight in kilograms,1968,,,,1968,,85122,,,0
H5,2020,2020,2020,6,1,1,Import,410,Rep. of Korea,KOR,392,Japan,JPN,,,,,,,,600642,"Fabrics; knitted or crocheted fabrics, other than those of headings 60.01 to 60.04, of artificial fibres, dyed",8,Weight in kilograms,8950,,,,8950,,275374,,,0
H5,2020,2020,2020,6,1,1,Import,410,Rep. of Korea,KOR,392,Japan,JPN,,,,,,,,600643,"Fabrics; knitted or crocheted fabrics, other than those of headings 60.01 to 60.04, of artificial fibres, of yarns of different colours",8,Weight in kilograms,156,,,,156,,5005,,,0
H5,2020,2020,2020,6,1,1,Import,410,Rep. of Korea,KOR,392,Japan,JPN,,,,,,,,600690,"Fabrics; knitted or crocheted fabrics, other than those of headings 60.01 to 60.04,and other than those made of wool, fine animal hair, cotton, synthetic or artificial fibres",8,Weight in kilograms,15922,,,,15922,,540438,,,0
H5,2020,2020,2020,6,1,1,Import,410,Rep. of Korea,KOR,392,Japan,JPN,,,,,,,,610120,"Coats; men's or boys' overcoats, car-coats, capes, anoraks, wind-jackets and similar articles, of cotton, knitted or crocheted (excluding those of heading no. 6103)",5,Number of items,4642,,,,3047,,327104,,,0
H5,2020,2020,2020,6,1,1,Import,410,Rep. of Korea,KOR,392,Japan,JPN,,,,,,,,610130,"Coats; men's or boys' overcoats, car-coats, capes, anoraks, wind-jackets and similar articles, of man-made fibres, knitted or crocheted, (excluding those of heading no. 6103)",5,Number of items,2310,,,,979,,193967,,,0
H5,2020,2020,2020,6,1,1,Import,410,Rep. of Korea,KOR,392,Japan,JPN,,,,,,,,610190,"Coats; men's or boys' overcoats, car-coats, capes, anoraks, wind-jackets and similar articles, of textile materials n.e.c. in heading no. 6101, knitted or crocheted (excluding those of heading no. 6103)",5,Number of items,267,,,,129,,30878,,,0
H5,2020,2020,2020,6,1,1,Import,410,Rep. of Korea,KOR,392,Japan,JPN,,,,,,,,610210,"Coats; women's or girls' overcoats, car-coats, capes, anoraks, wind-jackets and similar articles, of wool or fine animal hair, knitted or crocheted (excluding those of heading no. 6104)",5,Number of items,321,,,,183,,85675,,,0
H5,2020,2020,2020,6,1,1,Import,410,Rep. of Korea,KOR,392,Japan,JPN,,,,,,,,610220,"Coats; women's or girls' overcoats, car-coats, capes, anoraks, wind-jackets and similar articles, of cotton, knitted or crocheted (excluding those of heading no. 6104)",5,Number of items,415,,,,258,,41209,,,0
H5,2020,2020,2020,6,1,1,Import,410,Rep. of Korea,KOR,392,Japan,JPN,,,,,,,,610230,"Coats; women's or girls' overcoats, car-coats, capes, anoraks, wind-jackets and similar articles, of man-made fibres, knitted or crocheted (excluding those of heading no. 6104)",5,Number of items,4613,,,,2317,,708749,,,0
H5,2020,2020,2020,6,1,1,Import,410,Rep. of Korea,KOR,392,Japan,JPN,,,,,,,,610290,"Coats; women's or girls' overcoats, car-coats, capes, anoraks, wind-jackets and similar articles, of textile materials n.e.c. in heading no. 6102, knitted or crocheted (excluding those of heading no. 6104)",5,Number of items,220,,,,114,,57572,,,4
H5,2020,2020,2020,6,1,1,Import,410,Rep. of Korea,KOR,392,Japan,JPN,,,,,,,,610310,"Suits; men's or boys', knitted or crocheted",5,Number of items,610,,,,669,,235026,,,0
H5,2020,2020,2020,6,1,1,Import,410,Rep. of Korea,KOR,392,Japan,JPN,,,,,,,,610322,"Ensembles; men's or boys', of cotton, knitted or crocheted",5,Number of items,47,,,,34,,6592,,,4
H5,2020,2020,2020,6,1,1,Import,410,Rep. of Korea,KOR,392,Japan,JPN,,,,,,,,610331,"Jackets and blazers; men's or boys', of wool or fine animal hair, knitted or crocheted",5,Number of items,146,,,,92,,29963,,,0
H5,2020,2020,2020,6,1,1,Import,410,Rep. of Korea,KOR,392,Japan,JPN,,,,,,,,610332,"Jackets and blazers; men's or boys', of cotton, knitted or crocheted",5,Number of items,298,,,,169,,56743,,,0
H5,2020,2020,2020,6,1,1,Import,410,Rep. of Korea,KOR,392,Japan,JPN,,,,,,,,610333,"Jackets and blazers; men's or boys', of synthetic fibres, knitted or crocheted",5,Number of items,516,,,,245,,68149,,,0
H5,2020,2020,2020,6,1,1,Import,410,Rep. of Korea,KOR,392,Japan,JPN,,,,,,,,610339,"Jackets and blazers; men's or boys', of textile materials (other than wool or fine animal hair, cotton or synthetic fibres), knitted or crocheted",5,Number of items,47,,,,41,,8668,,,0
H5,2020,2020,2020,6,1,1,Import,410,Rep. of Korea,KOR,392,Japan,JPN,,,,,,,,610341,"Trousers, bib and brace overalls, breeches and shorts; men's or boys', of wool or fine animal hair, knitted or crocheted",5,Number of items,285,,,,133,,26321,,,4
H5,2020,2020,2020,6,1,1,Import,410,Rep. of Korea,KOR,392,Japan,JPN,,,,,,,,610342,"Trousers, bib and brace overalls, breeches and shorts; men's or boys', of cotton, knitted or crocheted",5,Number of items,1292,,,,686,,306700,,,0
H5,2020,2020,2020,6,1,1,Import,410,Rep. of Korea,KOR,392,Japan,JPN,,,,,,,,610343,"Trousers, bib and brace overalls, breeches and shorts; men's or boys', of synthetic fibres, knitted or crocheted",5,Number of items,916,,,,405,,96836,,,0
H5,2020,2020,2020,6,1,1,Import,410,Rep. of Korea,KOR,392,Japan,JPN,,,,,,,,610349,"Trousers, bib and brace overalls, breeches and shorts; men's or boys', of textile materials (other than wool or fine animal hair, cotton or synthetic fibres), knitted or crocheted",5,Number of items,314,,,,267,,18439,,,4
